,article_link,headline,is_sarcastic
2741,https://www.huffingtonpost.com/entry/donald trump executive overreach house republicans_us_57680ef5e4b015db1bc9f498,house republicans are getting uncomfortable with donald trump's stance on executive overreach,0
62,https://www.theonion.com/biologists announce they re all done with rodents 1819578401,biologists announce they're all done with rodents,1
1578,https://www.huffingtonpost.com/entry/sean penn sues lee daniels hitting women_us_5601a311e4b08820d91a6acc,sean penn sues 'empire' creator lee daniels for claiming the actor hits women,0
868,https://politics.theonion.com/sighing trump sexual assault accusers announce theyll t 1821197617,sighing trump sexual assault accusers announce they'll try coming forward again next week,1
2878,https://www.huffingtonpost.com/entry/scientists confirm theres nothing but misinformation on anti vax sites_us_563a31c7e4b0411d306f0cee,scientists confirm there's nothing but misinformation on anti vax sites,0
3020,https://www.huffingtonpost.com/entry/lady gaga american horror story hotel_us_55df441ee4b0e7117ba92082,lady gaga introduces us to her creepy 'american horror story: hotel' children,0
135,https://www.theonion.com/no makeup look easier to achieve than elle claims 1819567390,no makeup look easier to achieve than elle claims,1
1274,https://www.huffingtonpost.com/entry/an open letter to caitlyn jenner_b_7501854.html,an open letter to caitlyn jenner,0
2457,https://www.huffingtonpost.com/entry/an open letter to editors rejecting metoo meat14_us_5a0b3b8de4b006523921844f,"an open letter to editors rejecting metoo, meatfourteen submissions by victims",0
3140,https://www.huffingtonpost.comhttp://thinkprogress.org/climate/2016/01/19/3740829/ursula k le guin oregon lte/,novelist obliterates the bundy militia and oregon's largest newspaper in one hundred and ninety four words,0
24,https://entertainment.theonion.com/report john grisham slowly but surely climbing list of 1826058008,report: john grisham slowly but surely climbing list of greatest living american authors,1
2785,https://www.huffingtonpost.com/entry/donald trump china currency manipulation_us_5775213de4b0cc0fa13692c4,trump's obsession with chinese currency manipulation is sooo two thousand and fourteen,0
3270,https://www.huffingtonpost.com/entry/the woman marching next to you voted for trump will_us_5884f7a1e4b08f5134b62201,will intersectional feminism ever be one lane?,0
3282,https://www.huffingtonpost.com/entry/how fireflies work_us_55b92ecfe4b0074ba5a752c8,what makes fireflies light up? here's the whole story,0
1791,https://www.huffingtonpost.com/entry/trump clinton debate immigration_us_580840b2e4b0b994d4c43970,eleven year old declares a debate loser: donald trump,0
1223,https://www.huffingtonpost.com/entry/danny pintauro tony danza hiv disappointed_us_560ed687e4b0dd85030bf7f9,danny pintauro clarifies tony danza's 'disappointed' comment: 'he's worried about me more than anything',0
1115,https://www.huffingtonpost.com/entry/different from the norm 1_b_5793132.html,different from the norm: twelve unique hotel stays in nyc,0
3220,https://www.huffingtonpost.com/entry/patti smith advice_n_6585186.html,patti smith's advice about what really matters in life will give you chills,0
2605,https://www.huffingtonpost.com/entry/amy poehler emmys sweatshirt_us_55ff6854e4b08820d919259e,"amy poehler loses best lead actress in a comedy series, wins life",0
1552,https://www.huffingtonpost.com/entry/a day with hiv 2017_us_5a2184d0e4b03c44072d425e,a day with hiv' campaign tells the powerful stories of those affected by hiv,0
2335,https://www.huffingtonpost.com/entry/health risks dont make for a bad president_us_57bcbbf0e4b029a9a467cede,health risks don't make for a bad president,0
1792,https://www.huffingtonpost.com/entry/ben and jerrys new flavor_us_56a23afee4b0404eb8f1347f,ben and jerry's releases 'cake my day' as its newest flavor,0
2529,https://www.huffingtonpost.com/entry/betty peters common core_us_563e2a82e4b0307f2cadb27e,alabama education official warns of 'homosexualist' common core takeover,0
2472,https://www.huffingtonpost.com/entry/hm balmain campain photo_us_5605758fe4b0dd8503074867,the first handm x balmain campaign images are finally here,0
999,https://www.huffingtonpost.com/entry/guns sports stadiums_us_584e34f7e4b0bd9c3dfd51fe,washington state bill would allow guns in sports stadiums,0
1815,https://www.huffingtonpost.comhttp://www.ft.com/cms/s/0/c3de7f66 9f96 11e5 beba 5e33e2b79e46.html,one/five of u.s. adults live in or near poverty,0
1466,https://www.huffingtonpost.comhttps://www.propublica.org/article/the dea narco terror trap?utm_campaign=comms&utm_source=comms pitch&utm_medium=email&utm_term=narco terror,the narco terror trap,0
134,https://www.theonion.com/fatal school bus crash cements bff status 1819588524,fatal school bus crash cements bff status,1
1119,https://www.huffingtonpost.com/entry/9 month shot father cleaning gun_n_6206104.html,nine month old shot by father cleaning illegal gun,0
1718,https://www.huffingtonpost.com/entry/i am addicted to goodwill_b_7682704.html,i am addicted to goodwill,0
1139,https://www.huffingtonpost.com/entry/harry styles singing solo snl_us_58daa115e4b0d41721b9b2b3,harry styles will make his solo debut on 'saturday night live',0
1204,https://www.huffingtonpost.com/entry/vermont automatic voter registration_us_59970776e4b0e8cc855d58e8,new evidence this simple reform would get a lot more people registered to vote,0
2516,https://www.huffingtonpost.com/entry/demi lovato hello_us_5648ea5be4b08cda3489451c,demi lovato absolutely slays cover of adele's 'hello',0
2177,https://www.huffingtonpost.com/entry/blizzard northeast bombogenesis_us_5a4dd527e4b025f99e1fe850,heavy snow and high winds pound the east coast,0
613,https://local.theonion.com/mother provides adult son with list of questions to ask 1819577401,mother provides adult son with list of questions to ask doctor,1
1264,https://www.huffingtonpost.com/entry/c suite men stepping down for work life balance is no step forward_b_6905592.html,c suite men stepping down for 'work life balance' is no step forward,0
158,https://local.theonion.com/man s family rises to record high fourth priority 1819577274,man's family rises to record high fourth priority,1
2825,https://www.huffingtonpost.com/entry/palestinians starting to _b_7566552.html,palestinians starting to play on less uneven playing field,0
555,https://politics.theonion.com/this will be the end of trump s campaign says increa 1819578486,"this will be the end of trump's campaign,' says increasingly nervous man for seventh time this year",1
1997,https://www.huffingtonpost.com/entry/plane landing_us_58066972e4b0b994d4c1edf9,why this aborted airplane landing only looks like your worst nightmare,0
542,https://local.theonion.com/obituary cites teens love of music cars 1819567067,"obituary cites teen's love of music, cars",1
2780,https://www.huffingtonpost.com/entry/12 pieces of advice for president elect trump_us_5832357be4b0d28e55215174,twelve pieces of advice for president elect trump,0
2680,https://www.huffingtonpost.com/entry/network for public education study exposes charter_us_5a12ba34e4b0e30a958508c4,network for public education study exposes charter school scams,0
2394,https://www.huffingtonpost.com/entry/marquis govan ferguson_n_5857232.html,this eleven year old perfectly sums up the problems in ferguson,0
66,https://politics.theonion.com/trump makes last minute push to appeal to whites 1819579415,trump makes last minute push to appeal to whites,1
3321,https://www.huffingtonpost.com/entry/new zealand first cat paddles_us_59f038a0e4b0b7e63265ce3d,"meet paddles, the most powerful cat in new zealand",0
1859,https://www.huffingtonpost.com/entry/juno writer says it was absolutely a pro choice film_us_58eb565ae4b058f0a0305501,juno' writer says it's definitely not an 'anti choice movie',0
1412,https://www.huffingtonpost.com/entry/jimmy carter campus rapists_n_6271668.html,jimmy carter pushes colleges to get tougher on campus rapists,0
223,https://entertainment.theonion.com/new pixar employees required to watch adorable sexual h 1819571585,new pixar employees required to watch adorable sexual harassment video,1
2414,https://www.huffingtonpost.com/entry/7 ways to avoid looking like an idiot and enjoy a wine_us_57cf493be4b0f831f7060017,seven ways to look like a pro in a wine tasting room,0
1683,https://www.huffingtonpost.com/entry/so you want to talk about ghost in the shell the whitewashed_us_58f90f6ee4b0f02c3870e803,"so you want to talk about ghost in the shell, the whitewashed edition?",0
2501,https://www.huffingtonpost.com/entry/this prairie city deserves your travel dollars heres_us_5998f4ffe4b02eb2fda320af,this prairie city deserves your travel dollars. here's why.,0
118,https://www.theonion.com/final german u boat surrenders to allied powers 1819588851,final german u boat surrenders to allied powers,1
3461,https://www.huffingtonpost.com/entry/nia long on oscar voting invite_us_577697bfe4b0a629c1a9cced,nia long: film and tv should look like the world we live in,0
2616,https://www.huffingtonpost.com/entry/a digital magna carta between_b_6987036.html,a digital magna carta between two doors,0
1524,https://www.huffingtonpost.com/entry/the cop in the what are those meme loves that black panther joke_us_5aaae67de4b0c33361af0ae7,the cop in the 'what are those?' meme loves that 'black panther' joke,0
1694,https://www.huffingtonpost.com/entry/planned parenthood gop senate_us_57feca23e4b05eff558175a0,planned parenthood targets vulnerable gop senators with $two million ad campaign,0
179,https://www.theonion.com/google employees disappointed 15th anniversary party on 1819575642,google employees disappointed fifteenth anniversary party only has one solar powered lego drag race reffed by david pogue,1
70,https://www.theonion.com/magic markered initials fail to deter breakroom rice ca 1819567927,magic markered initials fail to deter breakroom rice cake thief,1
1697,https://www.huffingtonpost.com/entry/mike pence donald trump hamilton_us_5831bbf8e4b058ce7aab9dd7,mike pence's 'hamilton' recollection conflicts with donald trump's take,0
2078,https://www.huffingtonpost.com/entry/haiku reviews art roundup_b_6405390.html,haiku reviews: art two thousand and fourteen roundup iv,0
2554,https://www.huffingtonpost.com/entry/mistrial for alabama officer charged after assaulting indian man_us_55f34c51e4b077ca094f3942,mistrial for alabama officer charged after assaulting indian man,0
1861,https://www.huffingtonpost.com/entry/insider white house story porter_us_5a83bc64e4b0cf06751faa09,washington insider: white house story on porter 'doesn't add up',0
2797,https://www.huffingtonpost.com/entry/jyothi rao on threads of _b_7153792.html,jyothi rao: on threads of authenticity,0
263,https://politics.theonion.com/obama sort of freaked out after not receiving single e 1819572760,"obama sort of freaked out after not receiving single e mail, phone call for entire day",1
1601,https://www.huffingtonpost.com/entry/trevor noah donald trump stop and frisk_us_57ede013e4b0c2407cdd357c,trevor noah eviscerates donald trump's love of stop and frisk,0
1760,https://www.huffingtonpost.com/entry/asian models victorias secret fashion show_us_58420596e4b09e21702ec3e9,victoria's secret puts record number of asian models on its runway,0
477,https://local.theonion.com/plan to live in storage facility voiced 1819567111,plan to live in storage facility voiced,1
2443,https://www.huffingtonpost.com/entry/elizabeth warren housing finance_n_5577687.html,warren's mortgage reforms divide progressives,0
1148,https://www.huffingtonpost.com/entry/loretta lynch hate crimes_us_584ecbcce4b04c8e2bb0ac1a,loretta lynch: spike in anti muslim hate crimes is a 'stain on our nation's very soul',0
882,https://politics.theonion.com/last line of obama s military force request briefly men 1819577476,last line of obama's military force request briefly mentions possibility of twenty five year quagmire,1
106,https://politics.theonion.com/hooded members of congress drown another love child in 1820838488,hooded members of congress drown another love child in potomac to prevent affair from getting out,1
2644,https://www.huffingtonpost.com/entry/dean hart billy joel_us_57ff9dfce4b0162c043a4809,most long island politician ever attacks opponent for not loving billy joel enough,0
1801,https://www.huffingtonpost.com/entry/dog bird best friends_us_57881b1be4b03fc3ee502ed3,this big dog and little bird are inseparable pals,0
3298,https://www.huffingtonpost.com/entry/most of trumps voters dont think hes changed since taking office_us_5908705ee4b02655f84048aa,most of trump's voters don't think he's changed since taking office,0
2032,https://www.huffingtonpost.com/entry/so youre hiring a consult_b_6270402.html,so you're hiring a consultant? a few do's and dont's,0
2859,https://www.huffingtonpost.com/entry/aclu ribbon red carpet_us_58b35eade4b0780bac2a5308,blue aclu ribbons are the stars' best accessories at two thousand and seventeen oscars,0
3287,https://www.huffingtonpost.com/entry/house science committee winter_us_5840d32ce4b0c68e048022cc,the house science committee doesn't seem to understand the concept of winter,0
2928,https://www.huffingtonpost.com/entry/ballet moonlight_us_58b47dd2e4b0a8a9b7851da1,this dance inspired by 'moonlight' is almost as gorgeous as the real thing,0
2651,https://www.huffingtonpost.com/entry/mindbody therapies to eas_b_6115592.html,mind body therapies to ease insomnia,0
1973,https://www.huffingtonpost.com/entry/earth day travel_n_5187092.html,nine planet happy trips to book on earth day,0
3273,https://www.huffingtonpost.com/entry/abdul rahman peterkassig murder_n_5967376.html,giving abdul rahman kassig the last word,0
2158,https://www.huffingtonpost.com/entry/jaime king abuse lady gaga_us_56d593c0e4b0bf0dab33513b,jaime king reveals she experienced 'years of abuse as a minor' in moving message,0
1,https://politics.theonion.com/boehner just wants wife to listen not come up with alt 1819574302,"boehner just wants wife to listen, not come up with alternative debt reduction ideas",1
2115,https://www.huffingtonpost.com/entry/trump salmond letters wind farm_us_585ab35fe4b0d9a59456b982,trump once bombarded scottish leader with sixteen letters slamming a wind farm,0
79,https://www.theonion.com/that one mcdonalds plate from the 70s holy shit there 1819586984,"that one mcdonald's plate from the 'seventys: holy shit, there it is",1
205,https://www.theonion.com/small town beginning to wonder what taking heroin epide 1819579260,small town beginning to wonder what taking heroin epidemic so long to get there,1
2787,https://www.huffingtonpost.com/entry/sean spicer san bernardino_us_588f3d65e4b08a14f7e6f416,sean spicer uses san bernardino shooting to justify banning two hundred and twenty million people,0
2792,https://www.huffingtonpost.com/entry/jared leto joker_n_6125914.html,jared leto may play the joker in 'suicide squad',0
1225,https://www.huffingtonpost.com/entry/sean spicer typo goodbye email white house_us_59a90239e4b0dfaafcef40bf,of course sean spicer's goodbye email contained a typo,0
3103,https://www.huffingtonpost.com/entry/the gulf crisis fake news shines spotlight on psychological_us_596c4664e4b022bb9372b2f6,the gulf crisis: fake news shines spotlight on psychological warfare,0
1574,https://www.huffingtonpost.com/entry/three jews visit scandinavia_b_5643357.html,three jews visit scandinavia,0
2897,https://www.huffingtonpost.com/entry/tesla q2 deliveries_us_5779609ce4b09b4c43c0ce58,tesla's difficult month just got a little worse,0
1094,https://www.huffingtonpost.com/entry/obama orlando victims families_us_576309cbe4b0853f8bf03b79,"obama: families of gun violence victims don't care about politics, just change",0
3040,https://www.huffingtonpost.com/entry/snl shithole language sketches_us_5a5be979e4b03c418966e32b,saturday night live' can't use language as bad as trump's,0
1362,https://www.huffingtonpost.com/entry/william melendez preliminary hearing floyd dent_n_7463644.html,ex cop to stand trial in dashcam beating of unarmed motorist,0
3224,https://www.huffingtonpost.com/entry/8 year old spreads love in the classroom with braille valentines_us_56bce70ae4b08ffac1245fa2,eight year old spreads love in the classroom with braille valentines,0
1785,https://www.huffingtonpost.com/entry/two very different closets my life as the gay daughter_us_59da43e6e4b0cf2548b33824,two very different closets: my life as the gay daughter of a u.s. spy,0
1847,https://www.huffingtonpost.com/entry/justice department blindsided banking agency on marijuana reversal report_us_5a57bdcbe4b0d7e82dd5cf73,justice department blindsided banking agency on marijuana reversal: report,0
272,https://www.theonion.com/hubble telescope discovers giant amelia earhart statue 1819592315,hubble telescope discovers giant amelia earhart statue on distant planet,1
120,https://local.theonion.com/fed up brookstone body massage chair now only entertain 1819588319,fed up brookstone body massage chair now only entertaining serious buyers,1
1853,https://www.huffingtonpost.com/entry/house conservatives lame duck_us_56fad472e4b0143a9b49802f,house conservatives are trying to kill the lame duck session,0
962,https://www.theonion.com/slightest amount of physical contact apologized for 1819569304,slightest amount of physical contact apologized for,1
2514,https://www.huffingtonpost.com/entry/how to store wine_us_56c5f442e4b08ffac127e104,"the seven worst wine storage mistakes you can make, and how to fix them",0
736,https://entertainment.theonion.com/bad to the bone to be used in film 1819564264,bad to the bone to be used in film,1
632,https://entertainment.theonion.com/report music industry made 18 in 2009 1819571382,report: music industry made $eighteen in two thousand and nine,1
3011,https://www.huffingtonpost.com/entry/women in politics matter even when theyre not womens advocates_b_6866430.html,women in politics matter even when they're not women's advocates,0
586,https://www.theonion.com/god excited about first trip to japan 1819580084,god excited about first trip to japan,1
2719,https://www.huffingtonpost.com/entry/donald trump waxwork madrid topless protest_us_587e18dfe4b03549ebc065c6,topless protester in spain grabs waxwork donald trump's crotch,0
1577,https://www.huffingtonpost.com/entry/lee daniels made star for white people to feel good about being white_us_586fda8be4b099cdb0fcf7a2,lee daniels made 'star' for 'white people to feel good about being white',0
2450,https://www.huffingtonpost.com/entry/trump refugee admissions_us_5a2ecf0fe4b06e3bccf31026,trump lifts refugee ban but admissions still plummet,0
2998,https://www.huffingtonpost.com/entry/chicago climate change rahm emanuel_us_59de80d4e4b0eb18af05fb98,chicago is fighting climate change no matter what trump says,0
1097,https://www.huffingtonpost.com/entry/ellen degeneres trump_us_590b8286e4b0104c734d0e75,ellen isn't interested in having donald trump on her show,0
2494,https://www.huffingtonpost.com/entry/ridley scott blade runner sequel opening_us_564c8bc6e4b045bf3df1c8cf,ridley scott describes opening scene of 'blade runner' sequel in impressive detail,0
738,https://www.theonion.com/shotgun blast to abdomen just pisses wilford brimley of 1819587571,shotgun blast to abdomen just pisses wilford brimley off more,1
756,https://www.theonion.com/excercise ball all the way over there 1819588811,excercise ball all the way over there,1
837,https://politics.theonion.com/plows working around clock to keep new hampshire roads 1819592478,plows working around clock to keep new hampshire roads clear of campaign signs,1
2849,https://www.huffingtonpost.com/entry/growing up black gay and in the south_us_5a256aa4e4b04dacbc9bd933,growing up black and gay in the south,0
1215,https://www.huffingtonpost.com/entry/michelle obama joked about a simpler time when kids didnt have cellphones_us_59d3dbcae4b0218923e5b58c,michelle obama joked about a simpler time when kids didn't have cellphones,0
2556,https://www.huffingtonpost.com/entry/summer things to do_us_599b06b6e4b01f6e80200663,seventeen ways to make the most of what's left of summer,0
2950,https://www.huffingtonpost.com/entry/identity theft and credit card fraud who is really at risk_b_7471714.html,identity theft and credit card fraud... who is really at risk?,0
543,https://www.theonion.com/newly tenured professor now inspired to work harder tha 1819576102,newly tenured professor now inspired to work harder than ever,1
22,https://entertainment.theonion.com/trouble again in tvs africa 1819565669,trouble again in tv's africa,1
1567,https://www.huffingtonpost.com/entry/tyson beckford britney spears toxic video_us_58d56899e4b02a2eaab3bfa9,tyson beckford recalls the craziness before shooting britney spears' 'toxic' video,0
242,https://politics.theonion.com/paul ryan confident american people will warm up to tax 1821509050,paul ryan confident american people will warm up to tax plan once they realize life a cruel and meaningless farce,1
3237,https://www.huffingtonpost.comhttp://bigstory.ap.org/article/b183a022831d4748963fc8807c204b08/poll millennials more open idea slavery reparations,poll: millennials more open to idea of slavery reparations,0
1894,https://www.huffingtonpost.com/entry/formerly homeless student who worked several jobs graduates with honors_us_57473f11e4b0dacf7ad44f8b,once homeless student who worked four jobs to support family graduates college,0
2160,https://www.huffingtonpost.com/entry/we need to reverse the tr_b_5691310.html,humanitarians shouldn't have to risk their own lives in order to save others,0
2359,https://www.huffingtonpost.com/entry/the spice girls wannabe music video just got a rad feminist makeover_us_577bb23de4b0a629c1aaaeb0,the spice girls' 'wannabe' music video just got a rad feminist makeover,0
2176,https://www.huffingtonpost.com/entry/jewish refugees holocaust trump_us_588bbb21e4b08a14f7e5e7ca,dear president trump: our grandparents were refugees. this is their story.,0
681,https://www.theonion.com/hometown wistfully toured via google street view 1819574481,hometown wistfully toured via google street view,1
3213,https://www.huffingtonpost.com/entry/mosul could be a make or break battle for iraq_us_580e0519e4b0a03911ed973a,mosul could be a make or break battle for iraq,0
1762,https://www.huffingtonpost.com/entry/from ferguson to staten i_b_6272376.html,"from ferguson to staten island, justice and accountability are nowhere in sight",0
2912,https://www.huffingtonpost.com/entry/elizabeth gilbert hero journey question_n_6599616.html,the question all real life 'heroes' ask themselves,0
3210,https://www.huffingtonpost.com/entry/equinox lgbtq alphabet_us_59385e44e4b00610547ed993,equinox explores the fundamentals of lgbtq life in stunning new pride video,0
2547,https://www.huffingtonpost.com/entry/european vacation in phi_b_7958790.html,european vacation in philadelphia!,0
26,https://local.theonion.com/tupperware will never truly recover from red curry left 1819592714,tupperware will never truly recover from red curry leftovers,1
1723,https://www.huffingtonpost.com/entry/ how seriously does your_b_5582892.html,how seriously does your nonprofit board take the matter of ethics?,0
510,https://www.theonion.com/liability waiver carefully lowered into mine shaft 1819588700,liability waiver carefully lowered into mine shaft,1
2625,https://www.huffingtonpost.com/entry/unna whale dies seaworld_us_567993a0e4b06fa6887ee382,third whale this year dies at seaworld san antonio,0
404,https://entertainment.theonion.com/dolby theatre usher throws out matt damon for attemptin 1819579675,dolby theatre usher throws out matt damon for attempting to film oscars with camcorder,1
2330,https://www.huffingtonpost.com/entry/will ferrell world cup usa soccer_n_5532985.html,will ferrell is really pumped about the usa germany game,0
275,https://politics.theonion.com/voters glad they got hope in politicians out of system 1819578986,voters glad they got hope in politicians out of system for next election cycle or two,1
1979,https://www.huffingtonpost.com/entry/oklahoma tornadoes_us_56fcc960e4b083f5c606cc85,"multiple tornadoes rip through oklahoma, injuring seven",0
526,https://local.theonion.com/cat placed on 5 minutes half assed observation after p 1819579509,cat placed on five minutes' half assed observation after possibly ingesting plastic thing,1
1109,https://www.huffingtonpost.com/entry/bill paxton learns of his_b_7083100.html,bill paxton learns of his revolutionary past on 'who do you think you are?',0
2033,https://www.huffingtonpost.com/entry/statement sunglasses under 50_n_7109620.html,eleven statement making sunglasses under $fifty,0
1600,https://www.huffingtonpost.com/entry/dads say we want to have _n_5574656.html,"is 'having it all' possible for dads, too?",0
1944,https://www.huffingtonpost.com/entry/maxine waters womens convention donald trump_us_59f3a79fe4b03cd20b81b721,maxine waters to women's convention: trump is 'most dishonorable and despicable' president ever,0
68,https://www.theonion.com/man failing to heed harsh lessons of past orders sonic 1819576683,man failing to heed harsh lessons of past orders sonic bacon cheeseburger toaster,1
3272,https://www.huffingtonpost.com/entry/cher is gifting us with a broadway musical based on her life_us_5937f993e4b01fc18d3f3442,cher is gifting us with a broadway musical based on her life,0
988,https://entertainment.theonion.com/cameraman finds sole black person in studio audience 1819566935,cameraman finds sole black person in studio audience,1
2062,https://www.huffingtonpost.com/entry/donate eggs_b_5884734.html,i donated my eggs so i could travel the world,0
8,https://local.theonion.com/ex con back behind bar 1819589400,ex con back behind bar,1
269,https://www.theonion.com/15 years in environment of constant fear somehow fails 1819576202,fifteen years in environment of constant fear somehow fails to rehabilitate prisoner,1
