,article_link,headline,is_sarcastic
293,https://local.theonion.com/ex boyfriend hopes to still be terrible incompatible f 1825299729,"ex boyfriend hopes to still be terrible, incompatible friends",1
3181,https://www.huffingtonpost.com/entry/designers thank you michelle obama_us_5880dfb3e4b0e3a735676533,designers handwrite the words we all wish we could say to flotus,0
2858,https://www.huffingtonpost.com/entry/watch we asked new yorker_b_6261558.html,watch: we asked new yorkers one question...,0
2633,https://www.huffingtonpost.com/entry/car bomb kills three in southeastern turkey_us_57b1b608e4b069e7e505c07e,car bomb kills three in southeastern turkey,0
532,https://entertainment.theonion.com/coroners report john denver had sunshine on shoulders 1819564480,coroner's report: john denver had sunshine on shoulders at time of crash,1
566,https://politics.theonion.com/white house for russia the real sanction is knowing t 1822565236,"white house: 'for russia, the real sanction is knowing that they let us down'",1
2283,https://www.huffingtonpost.com/entry/american crime is a fine show and we have absolutely_us_59021718e4b00acb75f18580,"american crime' is a fine show, and we have absolutely, positively no idea where it's going",0
2386,https://www.huffingtonpost.com/entry/in argentina the supreme court spurs national outrage_us_592827f4e4b0d2a92f2f4305,"in argentina, the supreme court spurs national outrage with leniency for a 'dirty war' criminal",0
3157,https://www.huffingtonpost.com/entry/peter facinelli jaimie al_0_n_6901254.html,peter facinelli and jaimie alexander are engaged,0
1108,https://www.huffingtonpost.com/entry/fatal gun violence us_us_577f738de4b01edea78d5fd9,"house democrats demanded action on guns, but americans kept killing each other",0
3083,https://www.huffingtonpost.com/entry/cop killer luis enrique m_n_6053608.html,alleged cop killer flew under radar,0
1272,https://www.huffingtonpost.com/entry/jimmy kimmel donald trump typos_us_5ab335cfe4b054d118df9729,jimmy kimmel finally answers the question: is trump 'crazy or just dumb?',0
879,https://local.theonion.com/money spent for old times sake 1819571481,money spent for old time's sake,1
3160,https://www.huffingtonpost.com/entry/i wish for my daughter_us_5987aa37e4b00833d1de2928,what i wish for my daughter,0
3341,https://www.huffingtonpost.com/entry/issa hunter town halls_us_58c48e08e4b0d1078ca72ad5,republican congressmen torched at angry town hall meetings in california,0
2198,https://www.huffingtonpost.com/entry/this iphone x unveiling parody does not pull any punches_us_59b94f6fe4b0edff97187148,this iphone x unveiling parody doesn't pull any punches,0
765,https://www.theonion.com/god pledges 5 000 for cancer research 1819576703,"god pledges $five,zero for cancer research",1
2336,https://www.huffingtonpost.com/entry/donald trump invested carrier parent company_us_5841e069e4b017f37fe49844,"donald trump sold his investment in carrier's parent company, transition team says",0
390,https://www.theonion.com/body given false hope with first piece of fruit in 9 da 1819579359,body given false hope with first piece of fruit in nine days,1
3196,https://www.huffingtonpost.com/entry/two years after sandy addressing the emotional needs of survivors_b_6023932.html,two years after sandy: addressing the emotional needs of survivors,0
2639,https://www.huffingtonpost.com/entry/octavia spencer hidden figures screening low income families_us_587c6316e4b0e58057ff770e,octavia spencer bought out a screening of 'hidden figures' for low income families,0
798,https://www.theonion.com/poke with stick confirms raccoons death 1819569854,poke with stick confirms raccoon's death,1
1809,https://www.huffingtonpost.com/entry/dawn daluise facialist to the stars accused of hiring a hit man to kill competitor speaks out_us_56248036e4b0bce347012fa9,facialist to the stars accused of hiring a hit man to kill competitor speaks out,0
2125,https://www.huffingtonpost.com/entry/moving forward from charlottesville_us_599b58a4e4b0ac90f2cba94c,moving forward from charlottesville,0
551,https://www.theonion.com/celine dion served luxurious cat food in crystal goblet 1819586524,celine dion served luxurious cat food in crystal goblet,1
76,https://local.theonion.com/is area man going to finish those fries 1819565422,is area man going to finish those fries?,1
3262,https://www.huffingtonpost.com/entry/the paradox of addiction_b_6154112.html,the paradox of addiction,0
288,https://politics.theonion.com/area liberal no longer recognizes fanciful wildly inac 1819579440,"area liberal no longer recognizes fanciful, wildly inaccurate mental picture of country he lives in",1
2168,https://www.huffingtonpost.com/entry/arthamptons lifetime achi_b_7724498.html,arthamptons lifetime achievement award: ruth appelhof at the maidstone,0
2214,https://www.huffingtonpost.com/entry/a letter to ally parents from your lesbian friend_us_59ee49dce4b031d8582f576c,"a letter to ally parents, from your lesbian friend",0
1420,https://www.huffingtonpost.com/entry/maine vaccination rate_us_55f2d54be4b077ca094ea86b,this simple strategy helped maine achieve the nation's highest vaccination rate for toddlers,0
2824,https://www.huffingtonpost.com/entry/how to be an effective listener_us_59658c1ee4b0deab7c646cb9,how to be an effective listener,0
769,https://local.theonion.com/nation suspects leads in local high school play may be 1819569826,nation suspects leads in local high school play may be dating,1
810,https://entertainment.theonion.com/taylor swift mourns death of boyfriend christopher dorn 1819574535,taylor swift mourns death of boyfriend christopher dorner,1
1068,https://www.huffingtonpost.com/entry/really like you without music_us_55a65a9be4b04740a3de6947,tom hanks in carly rae jepsen's 'i really like you' video is oddly entertaining without music,0
787,https://politics.theonion.com/rubio refutes claim he soft on immigration by dragging 1819578531,rubio refutes claim he soft on immigration by dragging undocumented worker he knocked out cold onto stage,1
836,https://www.theonion.com/whale won t shut up about time it was beached 1819579825,whale won't shut up about time it was beached,1
2121,https://www.huffingtonpost.com/entry/how blaming many sides hurts our children_us_59937ae0e4b0a88ac1bc37fe,how blaming many sides hurts our children,0
3307,https://www.huffingtonpost.com/entry/trump media enemy poll_us_592f1a54e4b0e09b11ed2eb6,"trump backers share his animosity toward the media, poll shows",0
1110,https://www.huffingtonpost.com/entry/john weston celebrates birthday on top of plane_us_55c0ccbbe4b0b23e3ce3ffc0,fearless veteran celebrates ninetyth birthday on top of a plane,0
2242,https://www.huffingtonpost.com/entry/not like most girls_n_5790138.html,not like most girls,0
2119,https://www.huffingtonpost.com/entry/ruth bader ginsburg colin kaepernick regret_us_58013130e4b0e8c198a80efb,ruth bader ginsburg says she never should've waded into colin kaepernick controversy,0
2030,https://www.huffingtonpost.com/entry/tennis althea gibson statue us open_us_5a95bbf0e4b07dffeb6cf968,tennis legend althea gibson to be honored with statue at u.s. open site,0
858,https://entertainment.theonion.com/disney unveils first virgin princess 1819577965,disney unveils first virgin princess,1
1177,https://www.huffingtonpost.com/entry/interview director david_b_5970098.html,interview: director david dobkin on the judge,0
814,https://entertainment.theonion.com/studio admits entire israeli palestinian conflict just 1819571850,studio admits entire israeli palestinian conflict just marketing campaign for 'you don't mess with the zohan' that got out of hand,1
3310,https://www.huffingtonpost.com/entry/jordan klepper the opposition jon stewart_us_5a202d6de4b037b8ea206cd4,jordan klepper channels jon stewart in his own search for sanity,0
3039,https://www.huffingtonpost.com/entry/travel etiquette how to u_b_6488710.html,travel etiquette: how to use a flight delay to your advantage,0
1181,https://www.huffingtonpost.com/entry/avocado more expensive_us_58076482e4b0b994d4c2a3c2,avocados are about to get even more expensive,0
3369,https://www.huffingtonpost.com/entry/trump giuliani stormy daniels_us_5aeab918e4b00f70f0ef4627,trump backs rudy giuliani's claim that no campaign money went to stormy daniels,0
1133,https://www.huffingtonpost.com/entry/suicide squad box office record_us_57a60074e4b021fd9878c861,suicide squad' heads for record breaking $one hundred and forty five million plus opening weekend,0
3400,https://www.huffingtonpost.com/entry/three lessons from doing my daughters hair_us_594fe926e4b0326c0a8d0951,doing my daughter's hair makes me feel like a better dad,0
412,https://www.theonion.com/newborn prince of cambridge begins consolidating power 1825477519,newborn prince of cambridge begins consolidating power by having family imprisoned in tower of london,1
1522,https://www.huffingtonpost.com/entry/strudel obese dog fitness weight loss_us_59ecc19de4b00f08619f7e18,strudel the obese dog's fitness journey is nothing short of inspiring,0
3207,https://www.huffingtonpost.com/entry/neil gorsuch gay rights_us_589dcaf2e4b0ab2d2b145ec5,the only way to know what neil gorsuch really thinks about gay sex is to ask him about it,0
1180,https://www.huffingtonpost.com/entry/ridiculous reason women are excluded from exercise studies_us_57597f78e4b00f97fba7698f,ridiculous reason women are excluded from exercise studies,0
2331,https://www.huffingtonpost.com/entry/wwii veteran pilots fly on 92nd birthday_n_5927588.html,twin wwii pilots celebrate ninety twond birthdays with bird's eye view,0
2074,https://www.huffingtonpost.com/entry/its just 15 minutes to a grown up but not to kids_us_5839ae13e4b050dfe6187c35,"it's just fifteen minutes to a grown up, but not to kids",0
3462,https://www.huffingtonpost.com/entry/miles teller doing ok car accident_us_585d8ec0e4b0de3a08f5585c,miles teller doing ok after bronco flips over in car crash,0
3089,https://www.huffingtonpost.comhttp://fortune.com/2016/08/03/retirement savings actually fell over the past year/,retirement savings actually fell over the past year,0
1083,https://www.huffingtonpost.com/entry/msf refuses eu funding in protest at turkey migrant deal_us_5763be62e4b0853f8bf06afa,msf is refusing all eu funding in protest at turkey migrant deal,0
2831,https://www.huffingtonpost.com/entry/anna faris interview chris pratt split_us_5988a97be4b0449ed5042f16,anna faris was dropping hints about trouble with chris pratt before split,0
2541,https://www.huffingtonpost.com/entry/harry reid ted cruz_us_565f19a3e4b08e945fed9304,harry reid stunned by ted cruz's claim that most violent criminals are democrats,0
3041,https://www.huffingtonpost.comhttp://www.npr.org/2016/07/10/485432499/how police chaplains step in after departments cope with officer deaths,how police chaplains help departments cope with officer deaths,0
2162,https://www.huffingtonpost.comhttp://www.politico.com/story/2016/05/donald trump money net worth 223662,"donald trump is as rich as he says, if you do the accounting wrong",0
321,https://local.theonion.com/suspension of disbelief goes unrewarded 1819572258,suspension of disbelief goes unrewarded,1
1808,https://www.huffingtonpost.com/entry/berkhamsted penis map_n_5681466.html,this innocent map looks just like a penis,0
1729,https://www.huffingtonpost.com/entry/native american boy mohawk school_us_55fec2c4e4b0fde8b0ce9c5d,native american boy pulled from class over mohawk hairstyle,0
474,https://www.theonion.com/astronomers celebrate 300th anniversary of discovering 1819577085,astronomers celebrate three hundredth anniversary of discovering sky,1
2219,https://www.huffingtonpost.com/entry/watch homophobes have inv_b_6764078.html,watch: homophobes have invented a scary new tactic to undo equal rights,0
1961,https://www.huffingtonpost.com/entry/hasan minhaj inks netflix deal is first indian american to front weekly comedy show_us_5a984264e4b0479c02505bff,"hasan minhaj inks netflix deal, is first indian american to front weekly comedy show",0
1071,https://www.huffingtonpost.com/entry/mlb rules speed games 2018_us_5a8b09ffe4b05c2bcace02ce,new mlb rules aim to speed baseball games in two thousand and eighteen,0
2106,https://www.huffingtonpost.com/entry/crude oil train routes_n_6226512.html,government data sharpens focus on crude oil train routes,0
3133,https://www.huffingtonpost.com/entry/dont believe the derrick rose hype_us_56cdffa3e4b0ec6725e4d164,don't believe the derrick rose hype,0
2087,https://www.huffingtonpost.com/entry/michael b jordan responds trolls_n_7428500.html,michael b. jordan responds to trolls saying a black man can't play johnny storm,0
2379,https://www.huffingtonpost.com/entry/the must see attraction of 2015 in vegas_b_6426184.html,the must see attraction of two thousand and fifteen in vegas,0
1954,https://www.huffingtonpost.com/entry/miami cop lydia marquez facebook_us_55ee6d35e4b093be51bbec44,miami police officer's facebook plea: 'everyone's life matters',0
2367,https://www.huffingtonpost.com/entry/twitter is a more comfortable place for perpetrators_us_59ee7f10e4b08bce72fe032d,twitter is a more comfortable place for perpetrators than it is for sexual violence survivors,0
3172,https://www.huffingtonpost.com/entry/samantha bee trump roast_us_59054eb8e4b02655f83e0206,samantha bee rounds up comedians for the ultimate roast of donald trump,0
1341,https://www.huffingtonpost.com/entry/james corden usain bolt challenges_us_59f05ac3e4b04917c59450ee,james corden takes his feud with usain bolt to hilarious new heights,0
881,https://politics.theonion.com/precious little voter needs to feel inspired by candida 1819578715,precious little voter needs to feel inspired by candidate,1
3468,https://www.huffingtonpost.com/entry/donald trump erin burnett video_us_57f83edce4b0b6a430326776,cnn's erin burnett reports donald trump kissed her friend without consent,0
2200,https://www.huffingtonpost.com/entry/alvin ailey robert battle_n_6384646.html,the secrets behind the alvin ailey american dance theater,0
2052,https://www.huffingtonpost.com/entry/its time to get serious a_1_b_5946362.html,it's time to get serious about freedom of religion,0
1256,https://www.huffingtonpost.com/entry/scott israel florida sheriff nra dana loesch cnn_us_5a8e50f4e4b0617d4639e009,florida sheriff rebukes nra spokeswoman who claims she's 'fighting' for shooting survivors,0
3026,https://www.huffingtonpost.com/entry/accessories of the week _n_5700824.html,this is how you wear shoes with ankle straps,0
1738,https://www.huffingtonpost.com/entry/gap years are they effect_b_6208104.html,gap years: are they effective for students?,0
1279,https://www.huffingtonpost.com/entry/how to overcome social comparison_b_9365124.html,how to overcome social comparison,0
1759,https://www.huffingtonpost.com/entry/sanders clinton debate_us_56fab426e4b0143a9b49561f,"the sanders clinton debate flap, explained",0
1695,https://www.huffingtonpost.com/entry/a sexist comment is a sexist comment no matter who says it_us_57a89877e4b056bad2162711,"a sexist comment is a sexist comment, no matter who says it",0
1659,https://www.huffingtonpost.com/entry/senate republicans trump lie millions voting illegally_us_5887b2d6e4b0b481c76b791d,senate republicans won't refute trump's lie that millions voted illegally,0
3185,https://www.huffingtonpost.com/entry/souls of wisdom_b_5704207.html,souls of wisdom,0
2981,https://www.huffingtonpost.com/entry/internet mourns harambes death_us_592c17c7e4b0065b20b777f4,the internet mourns one year anniversary of harambe's death,0
985,https://www.theonion.com/leather clad nomads seize power in australia 1819567915,leather clad nomads seize power in australia,1
2754,https://www.huffingtonpost.com/entry/a woman is on the cover of womens running_us_57619449e4b09c926cfde30b,trans woman covers women's running body issue,0
31,https://www.theonion.com/ceos funeral a networking dream 1819569324,ceo's funeral a networking dream,1
822,https://local.theonion.com/camp counselor assigning kids to horses like wise town 1819580049,camp counselor assigning kids to horses like wise town matchmaker presiding over marriage,1
3005,https://www.huffingtonpost.com/entry/china plane island_us_5714e092e4b06f35cb6ff940,chinese military plane makes first public landing on disputed island,0
110,https://www.theonion.com/bumper nilla crop spells profit for wafer growers 1819568618,bumper nilla crop spells profit for wafer growers,1
2035,https://www.huffingtonpost.com/entry/you dont need to live in_b_5823430.html,you don't need to live in california to create this venice beach inspired living room,0
2131,https://www.huffingtonpost.com/entry/iggy azalea lorde nirvana_n_5465205.html,iggy azalea slams lorde's nirvana tribute,0
1287,https://www.huffingtonpost.com/entry/from peach cobbler to ban_b_8046326.html,from peach cobbler to banana pudding: ten delicious labor day desserts,0
2735,https://www.huffingtonpost.com/entry/seth meyers gop tax donald trump_us_5a3b6ba4e4b06d1621b1c99d,seth meyers: the gop tax bill is a 'brazen heist of the country',0
3029,https://www.huffingtonpost.com/entry/two conferences spotlight muslim worlds struggle to_us_59243dcee4b0b28a33f62f80,two conferences spotlight the muslim world's struggle to counter militancy,0
3063,https://www.huffingtonpost.com/entry/trump health care run for office_us_5970b811e4b0aa14ea78004b,the health care fight is driving more democrats to run for office,0
1081,https://www.huffingtonpost.com/entry/chelsea handler donald trump_us_582282ade4b0e80b02cdc1c8,chelsea handler has a last minute reminder why you shouldn't vote for trump,0
3254,https://www.huffingtonpost.com/entry/women in business qa sara_b_6639080.html,"women in business qanda: sarah davanzo, chief cultural strategy officer, sparks and honey",0
185,https://entertainment.theonion.com/local moviegoer enjoying movie so far 1819564030,local moviegoer enjoying movie so far,1
3409,https://www.huffingtonpost.com/entry/donald trump jr thanksgiving convo starters_us_5a1680bae4b064948072f260,donald trump jr.'s thanksgiving conversation starter tips spectacularly backfire,0
402,https://www.theonion.com/billions of electric signals between neurons allow brai 1819576197,billions of electric signals between neurons allow brain to imagine what michael imperioli looks like,1
2670,https://www.huffingtonpost.com/entry/he was a friend of mine jack slater_b_7294520.html,he was a friend of mine: jack slater,0
746,https://www.theonion.com/man not himself until he has so much coffee he feels li 1819576922,man not himself until he has so much coffee he feels like he's going to die,1
69,https://entertainment.theonion.com/ken burns completes documentary about fucking liars who 1819579264,ken burns completes documentary about fucking liars who claimed they watched entire 'jazz' series,1
1599,https://www.huffingtonpost.com/entry/brett ratner defamation case rape_us_59fb642de4b01b4740491a87,exclusive: lawyer of woman who says brett ratner raped her slams defamation suit,0
1501,https://www.huffingtonpost.comhttp://www.usatoday.com/story/news/2013/05/23/sri srinivasan judge supreme court circuit dc obama bush/2351543/,sri srinivasan: supreme court justice in the making?,0
937,https://entertainment.theonion.com/sounds of air hockey coming from supreme court chambers 1819587042,sounds of air hockey coming from supreme court chambers,1
141,https://www.theonion.com/local laundromat employs social media coordinator 1819575080,local laundromat employs social media coordinator,1
1696,https://www.huffingtonpost.com/entry/a reset button_b_6460096.html,a reset button,0
953,https://local.theonion.com/man approaches box of powdered doughnuts like snake dis 1819579376,man approaches box of powdered doughnuts like snake discovering unguarded clutch of bird eggs,1
1872,https://www.huffingtonpost.com/entry/9 things smart people wont do_us_5925db93e4b0aa7207986a45,nine things smart people won't do,0
65,https://www.theonion.com/vatican putting out feelers for how public would react 1819579340,vatican putting out feelers for how public would react to another children's crusade,1
956,https://politics.theonion.com/pbs moderators spend first 10 minutes of debate asking 1819578609,pbs moderators spend first ten minutes of debate asking candidates for fundraising advice,1
852,https://politics.theonion.com/obamas reunited live on tv for first time since leaving 1820540126,obamas reunited live on tv for first time since leaving white house,1
990,https://local.theonion.com/mathematical skill downplayed to get out of splitting c 1819577455,mathematical skill downplayed to get out of splitting check,1
1906,https://www.huffingtonpost.com/entry/elizabeth warren lobbying_us_59cd0d61e4b0e005cc572338,stealth lobbying campaign blamed elizabeth warren for 'socialist plot' she had nothing to do with,0
1653,https://www.huffingtonpost.com/entry/is your christmas present spying on you_b_6379154.html,is your christmas present spying on you?,0
1936,https://www.huffingtonpost.com/entry/what older voters expect from donald trump_us_58239547e4b0aac62488fe4a,what older voters expect from donald trump,0
2623,https://www.huffingtonpost.com/entry/changing the human narrat_b_5431076.html,changing the human narrative,0
564,https://www.theonion.com/government admits to hiding embarrassingly lame 1973 ex 1819573350,"government admits to hiding embarrassingly lame one thousand, nine hundred and seventy three extraterrestrial encounter",1
575,https://www.theonion.com/vatican quickly performs damage control on pope s toler 1819575336,vatican quickly performs damage control on pope's tolerant remarks,1
2820,https://www.huffingtonpost.com/entry/obama baton rouge_us_578bd3eae4b03fc3ee51403c,obama calls baton rouge police shooting 'the work of cowards who speak for no one',0
2944,https://www.huffingtonpost.com/entry/why we freeze in uncomfortable situations_us_59401e5ce4b0b13f2c6e4546,why we 'freeze' in uncomfortable situations,0
1881,https://www.huffingtonpost.com/entry/riz ahmed mindy kaling aziz ansari and more launch appeal for rohingya_us_5a0609fee4b0e37d2f3764d4,"riz ahmed, mindy kaling, aziz ansari and others launch appeal for rohingya",0
91,https://www.theonion.com/frontier airlines tells customers to just fucking deal 1819580035,frontier airlines tells customers to just fucking deal with it,1
2231,https://www.huffingtonpost.com/entry/trumps diplomacy is inappropriate delicious_us_58ee9e02e4b0bb9638e11c00,"trump's diplomacy is inappropriate, delicious",0
2621,https://www.huffingtonpost.com/entry/reporter confronts white man who calls him the n word_us_5808da5ee4b0180a36e9b01b,"reporter confronts white man who calls him the n word, slave",0
3463,https://www.huffingtonpost.com/entry/outcasting hetrick martin_us_572bbe5ae4b016f378953d9e,this teen learned to accept his sexuality and gender 'in different ways',0
649,https://local.theonion.com/family receives 38 piece astrazeneca assorted pill samp 1819577299,family receives thirty eight piece astrazeneca assorted pill sampler,1
1475,https://www.huffingtonpost.com/entry/rebel wilson sexual harassment tweets_us_5a0725ace4b01d21c83ecdc4,rebel wilson says 'male star' sexually harassed her while his friends tried to film,0
1160,https://www.huffingtonpost.com/entry/south syria cease fire and the next israel hizballah_us_596e237ae4b0376db8b65b13,south syria ceasefire and the next israel hizballah iran war,0
2531,https://www.huffingtonpost.com/entry/implicit bias training for agents_us_57727284e4b0dbb1bbbbe15f,"justice dept. mandates 'implicit bias' training for agents, lawyers",0
3416,https://www.huffingtonpost.com/entry/pipeline environmentalist terrorism_us_5a85c2ede4b0058d55672250,environmentalists say they're averting climate disaster. conservatives say it's terrorism.,0
1371,https://www.huffingtonpost.comhttp://www.nbcnews.com/news/latino/few latino kids attend catholic schools here s why n555041,few latino kids attend catholic schools here's why,0
485,https://politics.theonion.com/congress approves 15 billion medicruelty 1819564243,congress approves $fifteen billion medicruelty,1
1029,https://www.huffingtonpost.com/entry/spongebob squarepants nickelodeon resort punta cana_us_57e12687e4b0071a6e0953eb,spongebob' fans will love this pineapple shaped villa in punta cana,0
1555,https://www.huffingtonpost.com/entry/jody hice ken dious georgia_n_5839936.html,"jody hice, anti islam republican, defeats ken dious in georgia house race",0
936,https://local.theonion.com/man happy to set up job interview for fraternity brothe 1819578826,man happy to set up job interview for fraternity brother he once forced to drink own piss,1
1602,https://www.huffingtonpost.com/entry/what are some genius thin_b_5966882.html,the genius of chinese cooking,0
1036,https://www.huffingtonpost.com/entry/good food and healthy fam_b_6872140.html,good food and healthy families make a beautiful home,0
1457,https://www.huffingtonpost.com/entry/trumps not so new afghanistan strategy_us_599b9c11e4b0521e90cfb4d8,trump's not so new afghanistan strategy,0
793,https://local.theonion.com/girlfriends dad pretty hot 1819591066,girlfriend's dad pretty hot,1
463,https://www.theonion.com/nation s sleep experts recommend cutting down on strobe 1821011252,nation's sleep experts recommend cutting down on strobe light before bedtime,1
1243,https://www.huffingtonpost.com/entry/harambe grandma dead_us_58800bc1e4b00d44838d0234,harambe's grandmother euthanized at miami zoo,0
2873,https://www.huffingtonpost.com/entry/hear the siren from behind the fence_us_584ebce2e4b0151082221d78,hear the siren from behind the fence,0
1834,https://www.huffingtonpost.com/entry/north west penelope disick photos_us_55aa7437e4b065dfe89e85b3,north west and penelope disick are the cutest toddler duo around,0
684,https://www.theonion.com/recurring zhang ziyi fantasy always involves getting ki 1819567593,recurring zhang ziyi fantasy always involves getting kicked in the face,1
