,article_link,headline,is_sarcastic
414,https://www.theonion.com/self defense instructor keeps a couple of secrets to hi 1819568286,self defense instructor keeps a couple of secrets to himself,1
770,https://local.theonion.com/area woman has more than 200 products to help calm her 1819571819,area woman has more than two hundred products to help calm her,1
1289,https://www.huffingtonpost.com/entry/donald trump i fight like hell to pay less in taxes_us_55be41c5e4b0b23e3ce315e6,donald trump: 'i fight like hell' to pay less in taxes,0
2559,https://www.huffingtonpost.com/entry/women motherhood penalty_us_586d69fae4b0c4be0af2c02c,well off white men are three times more likely than women to get job interviews,0
58,https://www.theonion.com/teacher bitches about paycheck to sixth grade class 1819566662,teacher bitches about paycheck to sixth grade class,1
38,https://www.theonion.com/clinton becomes first president to clear 18 feet in pol 1819586822,clinton becomes first president to clear eighteen feet in pole vault,1
2093,https://www.huffingtonpost.com/entry/wall street journal climate change ads_us_57602f98e4b071ec19ef45d8,wall street journal ads call out the paper's bias on climate change,0
2436,https://www.huffingtonpost.com/entry/10 ludicrous things republicans have actually said about health_us_578f8cdfe4b0f180da63c608,ten ludicrous things republicans have actually said about health,0
1608,https://www.huffingtonpost.com/entry/elections corruption al franken_us_5759f0b4e4b0e39a28ad258f,"modern elections are corruption, sen. al franken argues",0
1953,https://www.huffingtonpost.com/entry/james van der beeks daughters had an amazing reaction to moana performance_us_58b6e8b9e4b0780bac2f13fe,james van der beek's daughters had an amazing reaction to 'moana' performance,0
1553,https://www.huffingtonpost.com/entry/watch clearing world ange_b_6474246.html,watch: clearing world anger,0
3404,https://www.huffingtonpost.com/entry/the 10 best cities to thr_b_7674890.html,the ten best cities to throw a pool party,0
228,https://local.theonion.com/man already has whole sentence lined up for later in co 1819580389,man already has whole sentence lined up for later in conversation,1
1995,https://www.huffingtonpost.com/entry/3 simple steps to take ba_b_7552974.html,three simple steps to take back control of your business day,0
168,https://local.theonion.com/rapture wreaks havoc on local book club 1819568980,rapture wreaks havoc on local book club,1
2142,https://www.huffingtonpost.com/entry/cheese advent calendar_us_58406e9ae4b017f37fe35d88,this cheese advent calendar is nacho typical yuletide treat,0
131,https://politics.theonion.com/obama begins inauguration festivities with ceremonial d 1819574406,obama begins inauguration festivities with ceremonial drone flyover,1
1996,https://www.huffingtonpost.com/entry/brazil olympics islamic state_us_578eb8dfe4b0f180da6389cc,brazil probes olympics threats after group backs islamic state,0
1512,https://www.huffingtonpost.com/entry/successful people stress_n_7518168.html,how successful people beat stress,0
1129,https://www.huffingtonpost.com/entry/leo kate_us_56a40645e4b0d8cc109a5ea4,six times leo and kate made the golden globes completely captivating,0
651,https://sports.theonion.com/westminster dog show finalists form elite iditarod team 1819588461,westminster dog show finalists form elite iditarod team,1
2538,https://www.huffingtonpost.com/entry/harry potter festival_us_57f7f6a1e4b0b6a43031f4ec,this town is becoming hogsmeade for one magical 'harry potter' weekend,0
252,https://local.theonion.com/area woman decides not to post facebook status that wou 1819574365,area woman decides not to post facebook status that would have tipped gun control debate,1
119,https://www.theonion.com/woman s head feared lost forever inside infinity scarf 1819592751,woman's head feared lost forever inside infinity scarf,1
1858,https://www.huffingtonpost.com/entry/pence catholic leaders share narrow of vision of_us_593db568e4b014ae8c69e1aa,"pence, catholic leaders share narrow vision of faith at prayer breakfast",0
3363,https://www.huffingtonpost.com/entry/james corden harry styles kiss_us_5a2fe75ee4b01598ac482c76,james corden and harry styles kiss for holiday themed 'carpool karaoke',0
2221,https://www.huffingtonpost.com/entry/federal ruling travel ban text_us_58c9d602e4b0ec9d29d89cfb,read the new federal court ruling blocking trump's travel ban,0
2773,https://www.huffingtonpost.com/entry/the most flattering eyeliner technique for your eye_us_5aa7f4e9e4b0826867e2ba6e,the most flattering eyeliner technique for your eye shape,0
662,https://local.theonion.com/area man could have made same meal at home but worse 1819577339,area man could have made same meal at home but worse,1
143,https://www.theonion.com/right to own handheld device that shoots deadly metal p 1819574320,right to own handheld device that shoots deadly metal pellets at high speed worth all of this,1
126,https://www.theonion.com/fcc sentences artie lange to death 1819587542,fcc sentences artie lange to death,1
1962,https://www.huffingtonpost.com/entry/weather channel john coleman hillary clinton_us_57c0b1ece4b0267344502b4a,climate denying weather channel founder frets about a hillary clinton victory,0
2548,https://www.huffingtonpost.comhttp://www.wired.com/2016/01/in a huge breakthrough googles ai beats a top player at the game of go/,"in a huge breakthrough, google's ai beats a top player at the game of go",0
3203,https://www.huffingtonpost.com/entry/hamilton music money_us_5713baeae4b0060ccda38521,america's 'hamilton' obsession is officially shaping the future of money,0
2006,https://www.huffingtonpost.comhttp://lithub.com/what does it mean when we call women girls/,what does it mean when we call women girls?,0
925,https://politics.theonion.com/marco rubio climbs over garden wall for forbidden midni 1819578069,marco rubio climbs over garden wall for forbidden midnight meeting with super pac,1
3015,https://www.huffingtonpost.com/entry/healthy living news_b_5301711.html,how to live to be one hundred and ten,0
3200,https://www.huffingtonpost.com/entry/self discovery_n_5351092.html,the importance of staring out the window,0
838,https://local.theonion.com/breaking flight attendant currently attempting to pass 1819577984,breaking: flight attendant currently attempting to pass cup of cranberry juice over your laptop,1
545,https://local.theonion.com/grandfather tries to make first fall as cool looking as 1819572956,grandfather tries to make first fall as cool looking as possible,1
2617,https://www.huffingtonpost.com/entry/michelle obama easter sunday style 2015_n_6999730.html,the first family looked exceptionally stylish on easter sunday. obvi.,0
2413,https://www.huffingtonpost.com/entry/dascha polanco insecure_us_5972360be4b0e79ec198fb4d,dascha polanco opens up about what makes her insecure,0
2083,https://www.huffingtonpost.com/entry/shoplifter book_n_5725458.html,graphic novel perfectly captures post grad life,0
1904,https://www.huffingtonpost.com/entry/laurie hernandez val chmerkovskiy win dancing with the stars_us_583500f3e4b01ba68ac393fd,gymnast laurie hernandez and val chmerkovskiy win 'dancing with the stars',0
417,https://entertainment.theonion.com/quake claims 500 hours 1819565271,quake claims five hundred hours,1
2913,https://www.huffingtonpost.com/entry/lessons learned from a presidents day accident_b_6689816.html,lessons from a president's day accident,0
1123,https://www.huffingtonpost.com/entry/6 reasons why i dont force my children to share_us_571be3fae4b0854bc7794d4f,six reasons why i don't force my children to share,0
1471,https://www.huffingtonpost.com/entry/ecuador global tax dodging_us_5877e5c9e4b0b3c7a7b05339,new developing nations leader has big plans to crack down on global tax dodging,0
2942,https://www.huffingtonpost.com/entry/women in business qa roxa_b_7419114.html,"women in business qanda: roxane divol, svp and gm, trust services, symantec",0
428,https://www.theonion.com/high school student council passes nonbinding resolutio 1819569010,high school student council passes nonbinding resolution,1
203,https://local.theonion.com/man who skipped airport s moving walkway immediately re 1819579777,man who skipped airport's moving walkway immediately realizes what an arrogant fool he's been,1
3188,https://www.huffingtonpost.com/entry/helping ukraine how_b_5268913.html,helping ukraine: how?,0
775,https://entertainment.theonion.com/man trapped under boulder braces for possible good morn 1819566982,man trapped under boulder braces for possible good morning america interview,1
2180,https://www.huffingtonpost.com/entry/what is rhubarb recipes_us_5af2f879e4b0aab8a78b4a6b,a rhubarb explainer for everyone who's still confused,0
1173,https://www.huffingtonpost.com/entry/meryl streep hot dogs_us_57acaa17e4b06e52746f7f9d,meryl streep weighs in on the 'are hot dogs sandwiches?' debate,0
846,https://politics.theonion.com/ape appointed banana czar 1819586221,ape appointed banana czar,1
2041,https://www.huffingtonpost.com/entry/howard dean guns dnc_us_579805d6e4b02d5d5ed372d8,"guns are 'the ultimate public health crisis,' howard dean tells democratic convention",0
107,https://www.theonion.com/alcoholic kindergarten teacher stretches naptime to thr 1819568162,alcoholic kindergarten teacher stretches naptime to three hours,1
723,https://local.theonion.com/dads marine corps training evident during christmas pre 1819567645,dad's marine corps training evident during christmas present opening,1
2734,https://www.huffingtonpost.comhttp://huff.lv/21UZNhs,trump won't stop joking about dating his daughter,0
3348,https://www.huffingtonpost.com/entry/alfred enoch black hermione harry potter_us_56be0d02e4b0b40245c6433d,harry potter' actor alfred enoch says there's no reason hermione can't be black,0
2483,https://www.huffingtonpost.com/entry/getting the facts right a_b_6233660.html,getting the facts right about the ferguson grand jury decision,0
265,https://local.theonion.com/everyone in family compliments grandmother on how small 1819577242,everyone in family compliments grandmother on how small and feeble she's gotten,1
2829,https://www.huffingtonpost.com/entry/johnson johnson wins reversal of 72 million verdict over talc cancer risks_us_59e78eace4b08f9f9edc475e,johnson and johnson wins reversal of $seventy two million verdict over talc cancer risks,0
1786,https://www.huffingtonpost.com/entry/why nomsense made so much_b_6292298.html,"why nomsense made so much sense: a tale of three best friends, two cookies and cake crumble",0
610,https://entertainment.theonion.com/entertainment weekly critic lets director redo sorority 1819571059,entertainment weekly' critic lets director redo 'sorority row' for better grade,1
2589,https://www.huffingtonpost.com/entry/this horror movie trailer is a spooky way to announce a pregnancy_us_568e7f83e4b0a2b6fb6ee2b4,this horror movie trailer is a spooky way to announce a pregnancy,0
780,https://www.theonion.com/ikea ceo wants new desk on his desk by end of day 1819592092,ikea ceo wants new desk on his desk by end of day,1
904,https://www.theonion.com/woman seems too hot to be riding bus 1819587368,woman seems too hot to be riding bus,1
2423,https://www.huffingtonpost.com/entry/michael phelps katie ledecky rio olympics_us_57b1d12be4b071840411ef2d,"this time, michael phelps is asking for katie ledecky's autograph",0
1455,https://www.huffingtonpost.com/entry/donald trump posed as spokesman_us_5738e2dce4b08f96c1837472,top aide denies that donald trump posed as his own spokesman,0
2271,https://www.huffingtonpost.com/entry/stephen colbert facebook for restricting fake news trump_us_582c414be4b0e39c1fa71c2e,stephen colbert rips facebook for restricting fake news after trump win,0
3112,https://www.huffingtonpost.com/entry/iran deal within one vote of being veto proof_us_55e5e3d0e4b0c818f61948c5,obama within one vote of victory on iran deal,0
323,https://politics.theonion.com/45 year old to help candidate understand youth vote 1819577119,forty five year old to help candidate understand youth vote,1
25,https://www.theonion.com/ghost cant make a simple cup of coffee without everyone 1819567608,ghost can't make a simple cup of coffee without everyone freaking out,1
2796,https://www.huffingtonpost.com/entry/world bank poised to deny_b_5592475.html,world bank poised to deny africa's indigenous peoples their rights,0
1523,https://www.huffingtonpost.com/entry/oil and ga game ends_b_6061194.html,the end of the big oil and gas game has come,0
284,https://www.theonion.com/arizona iced tea unveils new 4 foot tall cans 1819590557,arizona iced tea unveils new four foot tall cans,1
1182,https://www.huffingtonpost.com/entry/big mac creator jim delligatti dies at age 98_us_583f1cd7e4b09e21702c190c,big mac creator jim delligatti dies at ninety eight,0
2157,https://www.huffingtonpost.com/entry/is sportswear the key to_b_12274188.html,can sportswear make sustainability cool?,0
2663,https://www.huffingtonpost.com/entry/erin andrews marshall henderson_n_7108834.html,ex college basketball star waits two years to send the perfect tweet,0
2889,https://www.huffingtonpost.com/entry/eu court issues landmark data ruling_us_5613b40be4b0baa355ad263e,eu court issues landmark data ruling,0
2324,https://www.huffingtonpost.com/entry/jesus loves trump but he wouldnt vote for him_us_57f94d50e4b0d786aa52b431,"jesus loves trump, but he wouldn't vote for him",0
3012,https://www.huffingtonpost.com/entry/victorias secret ad super bowl_n_6519170.html,you've never seen the victoria's secret angels like this before,0
3016,https://www.huffingtonpost.comhttp://live.huffingtonpost.com/r/segment/william shatner leonard nimoy book interview/56a24e0999ec6d855f001d11,watch live: william shatner discusses the life of late friend leonard nimoy,0
306,https://www.theonion.com/usda admits weight loss not possible for people who don 1819579231,usda admits weight loss not possible for people who don't like salmon,1
1295,https://www.huffingtonpost.com/entry/dutch to destroy 8000 du_n_6203322.html,"dutch heath authorities to kill eight,zero ducks to prevent bird flu",0
3377,https://www.huffingtonpost.com/entry/hurricane katrina new orleans cops_us_571815d8e4b0c9244a7ad564,ex new orleans cops plead guilty in post katrina killings,0
309,https://www.theonion.com/very specific food pyramid recommends two to three shri 1819569561,very specific food pyramid recommends two to three shrimp scampis per year,1
3296,https://www.huffingtonpost.com/entry/robert durst admits he was high on meth the whole time while filming the jinx_us_585580e1e4b03904470917e0,robert durst admits he was high on meth 'the whole time' while filming 'the jinx',0
2322,https://www.huffingtonpost.com/entry/star wars force awakens honest trailer_us_563a7a84e4b0b24aee48b394,this honest 'star wars' teaser puts the pressure on j.j. abrams,0
1844,https://www.huffingtonpost.com/entry/trump staff shake up_us_592dd443e4b055a197cdd9dd,look out! there's a 'staff shake up' looming for the white house,0
409,https://local.theonion.com/town nervously welcomes veteran back home 1819575479,town nervously welcomes veteran back home,1
381,https://local.theonion.com/changing weather inspires area conversationalist 1819564896,changing weather inspires area conversationalist,1
3227,https://www.huffingtonpost.com/entry/oliver north school shootings_us_5b018dece4b0a046186d22be,oliver north blames school shootings on ritalin,0
2801,https://www.huffingtonpost.com/entry/alleged shooter who killed 8 had long history of domestic violence_us_55c8d1bee4b0923c12bd89ec,alleged shooter who killed eight had long history of domestic violence,0
2300,https://www.huffingtonpost.com/entry/see the celebrities who went all out for halloween this year_us_59f9bfcbe4b046017fb013a5,see the celebrities who went all out for halloween this year,0
295,https://local.theonion.com/weekend encounter with coworker never acknowledged 1819574897,weekend encounter with coworker never acknowledged,1
2923,https://www.huffingtonpost.com/entry/what shale gas revolution_b_5896254.html,what shale gas revolution means for international energy geopolitics and new world order?,0
2238,https://www.huffingtonpost.com/entry/david fahrenthold donald trump charity_us_57e1986ce4b08d73b82e05a2,trump faces allegations over charity that forced other politicians to resign,0
255,https://www.theonion.com/suzanne somers named u s thighmaster general 1819586302,suzanne somers named u.s. thighmaster general,1
2634,https://www.huffingtonpost.com/entry/words of hope campaign_n_6350850.html,here's how you can help lgbt survivors of prison rape this holiday season,0
1951,https://www.huffingtonpost.com/entry/german anti immigrant party sees gains after terrorist attacks_us_579de285e4b0693164c18ee0,german anti immigrant party sees gains after terrorist attacks,0
2036,https://www.huffingtonpost.com/entry/time to redefine and de s_b_6129908.html,time to redefine and de silo online safety efforts,0
115,https://local.theonion.com/man not certain what any of his coworkers names are 1819574786,man not certain what any of his coworkers' names are,1
2845,https://www.huffingtonpost.comhttps://www.propublica.org/article/the corporate takeover of the red cross,how atandt execs took over the red cross and hurt its ability to help people,0
2706,https://www.huffingtonpost.com/entry/ernie els putt_n_5595127.html,watch: former british open champ makes embarrassing putting fail,0
183,https://politics.theonion.com/voters shocked christie botched such an easy political 1819575996,voters shocked christie botched such an easy political cover up,1
596,https://www.theonion.com/new evidence suggests early humans first used fire to i 1819578688,new evidence suggests early humans first used fire to impress friends,1
1356,https://www.huffingtonpost.com/entry/canadian officials start to get handle on massive wildfire_us_572fa585e4b016f37896284b,canadian officials start to get handle on massive wildfire,0
64,https://www.theonion.com/newspaper starting to worry spending so much time on fa 1819580373,newspaper starting to worry spending so much time on facebook not healthy for it,1
164,https://local.theonion.com/police release haircut progressed photo of missing woma 1819577510,police release haircut progressed photo of missing woman,1
891,https://www.theonion.com/neglect of wife children results in promotion 1819565401,"neglect of wife, children results in promotion",1
568,https://www.theonion.com/bank of america introduces new 50 underdraft fee 1819576899,bank of america introduces new $fifty underdraft fee,1
1994,https://www.huffingtonpost.com/entry/california pet store ban puppies kittens cats dogs rabbits_us_59e216b2e4b0a52aca183fa3,"california bans pet shop sales of non rescue cats, dogs and rabbits",0
528,https://local.theonion.com/woman been thinking about getting bangs for past 8 year 1826362394,woman been thinking about getting bangs for past eight years,1
1127,https://www.huffingtonpost.com/entry/lena dunham golden globes dress 2015_n_6430084.html,lena dunham matches the red carpet,0
433,https://www.theonion.com/quick painless death tops holiday wish list of local v 1819564140,"quick, painless death tops holiday wish list of local veal calf",1
2604,https://www.huffingtonpost.com/entry/trump iran deal sanctions_us_5aeca9d9e4b0c4f193226f92,"trump to violate iran nuclear deal, vows to reimpose sanctions",0
2768,https://www.huffingtonpost.com/entry/dread scott art interview_us_58a21e46e4b0ab2d2b17fc11,activist artist dread scott on why we need a revolution,0
1982,https://www.huffingtonpost.com/entry/who antibiotics farm animals_us_5a01fa3be4b0920530585dd9,who urges end to routine antibiotic use in farm animals to stem rise of superbugs,0
1113,https://www.huffingtonpost.com/entry/disgruntled texas man kills co worker_us_572a1364e4b016f378944193,"texas man kills co worker, then takes own life",0
3075,https://www.huffingtonpost.com/entry/15 blog posts by latinos that got us talking in 2015_us_5685723fe4b014efe0da688e,fifteen blog posts by latinos that got us talking in two thousand and fifteen,0
2408,https://www.huffingtonpost.com/entry/trump wiretap claim goose chase_us_58d1821ce4b0be71dcf8cb12,"trump's wild wiretap goose chase has no end in sight, apparently",0
2156,https://www.huffingtonpost.com/entry/sexual assault transcripts atixa_us_560420d0e4b0fde8b0d18d42,"students punished for sexual assault should have transcripts marked, title ix group says",0
398,https://www.theonion.com/fda confirms psilocybin reduces risk of mindlessly foll 1821046978,fda confirms psilocybin reduces risk of mindlessly following society's rules like fucking lemming,1
1365,https://www.huffingtonpost.com/entry/jeremy wade river monsters_us_571a918ee4b0d4d3f7236a35,how the host of 'river monsters' hopes his show will inspire environmentalism,0
2159,https://www.huffingtonpost.com/entry/elizabeth warren alexander acosta workplace safety_us_58d29f04e4b02d33b7479ba8,elizabeth warren grills trump's labor nominee over workplace safety,0
2903,https://www.huffingtonpost.com/entry/archbishop mar gregorios yohanna ibrahim and archbishop boulos yazigi _b_5186945.html,a plea to free archbishop mar gregorios yohanna ibrahim and archbishop boulos yazigi who were kidnapped one year ago today,0
2921,https://www.huffingtonpost.com/entry/james cameron james horner titanic_n_7649174.html,james cameron cried the first time he heard james horner's 'titanic' theme,0
2267,https://www.huffingtonpost.com/entry/adele make you feel my love brussels_us_56f1bc39e4b0c3ef521726b0,adele sends her love to brussels with touching tribute,0
563,https://www.theonion.com/nation s journalists remember quaint time when huffing 1819580319,nation's journalists remember quaint time when 'huffington post' seemed like death of news industry,1
1701,https://www.huffingtonpost.com/entry/dog trust fall_us_578e1e66e4b0a0ae97c34ebe,does your dog trust you enough to do this?,0
148,https://www.theonion.com/outdoor movie guest excited to watch barely audible ba 1819577856,outdoor movie guest excited to watch barely audible 'back to the future' while sitting on tree root,1
1626,https://www.huffingtonpost.com/entry/for all the girls i loved_b_5214674.html,for all the girls i loved before i knew i could,0
2462,https://www.huffingtonpost.com/entry/robin williams mashup_n_5672130.html,video proof robin williams will always make us laugh,0
3411,https://www.huffingtonpost.com/entry/healthy lifestyle_b_5182911.html,your money or your life,0
89,https://www.theonion.com/dsm 5 updated to accommodate man who is legitimately 1819579090,dsm five' updated to accommodate man who is legitimately being ordered to kill by the moon,1
2447,https://www.huffingtonpost.com/entry/supreme court louisiana abortion_us_56d9fb63e4b0000de404a7a4,supreme court steps in to keep louisiana abortion clinics open,0
578,https://entertainment.theonion.com/bill cosby feeling better now 1819586213,bill cosby feeling better now,1
2435,https://www.huffingtonpost.com/entry/college tinder strategy_us_55ad4e3ae4b0d2ded39fb1c2,college junior shares his strategy for getting the most out of tinder,0
2439,https://www.huffingtonpost.com/entry/best fall shoes to wear this year_us_56059fdce4b0768126fd8357,these are the only five shoes you need in your closet this fall,0
1010,https://www.huffingtonpost.com/entry/what love is not 11 truths i want my sons to know on valentines day_b_6683634.html,what love is not: eleven truths i want my sons to know on valentine's day,0
2476,https://www.huffingtonpost.com/entry/3 secrets for increasing your happiness_b_8884996.html,three secrets for increasing your happiness,0
2356,https://www.huffingtonpost.com/entry/turning 60_b_11479876.html,why i know turning sixty will be one big party,0
2974,https://www.huffingtonpost.com/entry/greasy strangler elijah wood daniel noah josh c waller_us_56af5d84e4b00b033aafae27,the fellowship of the film,0
1179,https://www.huffingtonpost.com/entry/north carolina sheriffs deputies disciplined over trump rally_us_56ea0f6fe4b0860f99db9106,north carolina sheriff's deputies disciplined over trump rally,0
2895,https://www.huffingtonpost.com/entry/daniel boulud awards scho_b_5168520.html,daniel boulud awards scholarship to c cap alum,0
1789,https://www.huffingtonpost.com/entry/taylor swift dick clark new year_n_6403738.html,taylor swift rocks a crop top for her new year's eve performance,0
103,https://entertainment.theonion.com/woman who admits to having watched golden globes thinks 1819574376,woman who admits to having watched golden globes thinks jodie foster embarrassed herself,1
2088,https://www.huffingtonpost.com/entry/the problem with paternalizing disabled people to protest_us_583b41dde4b050dfe6187d48,the problem with paternalizing disabled people to protest donald trump,0
331,https://local.theonion.com/madcap romp escalates into zany hijinks 1819564662,madcap romp escalates into zany hijinks,1
2266,https://www.huffingtonpost.com/entry/robert reich interview_us_56a106f4e4b0d8cc1098edc5,how robert reich is persuading the country to fight for economic equality,0
1702,https://www.huffingtonpost.com/entry/fan ho hong kong photos_n_5852420.html,these gorgeous photos of hong kong in the fifties will make you nostalgic for an era long gone,0
2522,https://www.huffingtonpost.com/entry/jordan hancock police video_us_5af30b20e4b0aab8a78b8678,denver mayor's son caught on tape berating cop as a 'faggot',0
3117,https://www.huffingtonpost.com/entry/dear critical white scholar and colleague_us_59347797e4b00573ab57a4aa,dear critical white scholar and colleague:,0
2645,https://www.huffingtonpost.com/entry/us job growth rises briskly wages continue to climb_us_58c2b407e4b054a0ea6a1640,"u.s. job growth rises briskly, wages continue to climb",0
1941,https://www.huffingtonpost.com/entry/jason priestly shannen doherty cancer_us_579a14bee4b02d5d5ed48921,jason priestley praises shannen doherty's bravery amid cancer battle,0
