,article_link,headline,is_sarcastic
2882,https://www.huffingtonpost.com/entry/business gains are double_b_6636928.html,business gains are doubled when they're done with love,0
1282,https://www.huffingtonpost.com/entry/madonna new song met gala performance_us_5af1d0eee4b0ab5c3d6a8a43,madonna teases new song at surprise met gala performance,0
627,https://local.theonion.com/man always gets little rush out of telling people john 1819578998,man always gets little rush out of telling people john lennon beat wife,1
2850,https://www.huffingtonpost.com/entry/stephen colbert scotus gay marriage_n_7680398.html,stephen colbert destroys dissenting justices in same sex marriage decision,0
1106,https://www.huffingtonpost.com/entry/republicans minimum wage donald trump_us_574729b6e4b03ede44141876,here's how to get republicans to change their minds on the minimum wage,0
2071,https://www.huffingtonpost.com/entry/alyssa edwards all stars drag race_us_57fd1171e4b0b6a43035aedf,last words: alyssa edwards reflects on 'rupaul's all stars drag race',0
2624,https://www.huffingtonpost.com/entry/religious persecution on_b_7870614.html,religious persecution on the rise: minorities under threat in the middle east,0
2345,https://www.huffingtonpost.com/entry/forgiveness for mother and child_b_6881228.html,forgiveness for mother and child,0
504,https://www.theonion.com/department of defense unveils 83 million thing that sh 1819571777,department of defense unveils $eighty three million thing that shoots,1
230,https://entertainment.theonion.com/drummers girlfriend thinks he should sing 1819566660,drummer's girlfriend thinks he should sing,1
1017,https://www.huffingtonpost.com/entry/10 essential life lessons_n_7061560.html,ten essential life lessons from a grandma,0
1060,https://www.huffingtonpost.com/entry/suspect spills beans about planned burglary in mistaken 911 call_us_55c796b9e4b0f1cbf1e55504,suspect spills beans about planned burglary in mistaken nine hundred and eleven call,0
3257,https://www.huffingtonpost.com/entry/jaelynn willey life support_us_5ab48559e4b054d118e1722e,maryland high school shooting victim to be taken off life support,0
1474,https://www.huffingtonpost.com/entry/a very gassy babys letter to a new mom circa 1980_b_7194884.html,"a 'very gassy baby's' letter to a new mom, circa one thousand, nine hundred and eighty",0
3320,https://www.huffingtonpost.com/entry/mattis tillerson want blank check to wage illegal_us_5a0063dde4b0d467d4c226b4,"mattis, tillerson want blank check to wage illegal war",0
418,https://www.theonion.com/unconsciousness faked to make anesthesiologist feel bet 1819588655,unconsciousness faked to make anesthesiologist feel better,1
371,https://www.theonion.com/married couple longs for days when they only quietly re 1819578667,married couple longs for days when they only quietly resented one another,1
1589,https://www.huffingtonpost.com/entry/the importance of increasing efficiency_b_7153212.html,the importance of increasing efficiency in new york city government,0
3058,https://www.huffingtonpost.com/entry/shawn mendes iheartradio music awards_us_58bcc149e4b0b99894185ba6,everyone is in love with shawn mendes after iheartradio music awards performance,0
2286,https://www.huffingtonpost.com/entry/springsteen on broadway review_us_59df7e77e4b0eb18af06b770,springsteen on broadway' is the 'rock and roll storybook' dreams are made of,0
2848,https://www.huffingtonpost.com/entry/shaqtin a fool top moments_n_7564522.html,the thirty most wtf moments of the two thousand and fourteen two thousand and fifteen nba season,0
1857,https://www.huffingtonpost.com/entry/syria ceasefire us russia_us_56cb2ff1e4b0ec6725e332d2,u.s russian plan calls for syria ceasefire starting saturday,0
1236,https://www.huffingtonpost.com/entry/call me maybe can i really be quoting carly rae jepsen_us_596bcc83e4b022bb9372b2b8,"as i grieve, 'maybe' has become a positive tool to help me find balance",0
1656,https://www.huffingtonpost.com/entry/why the united states needs a_b_6317780.html,"why the united states needs a ""ladenschlussgesetz""",0
2167,https://www.huffingtonpost.com/entry/hungary gay sex trafficking ring_us_5894bdf9e4b040613136aa35,men face up to two hundred years in prison for gay sex trafficking,0
3391,https://www.huffingtonpost.comhttps://www.washingtonpost.com/world/immigration backlash at the heart of british push to leave the eu/2016/05/22/db54ad60 1c27 11e6 82c2 a7dcb313287d_story.html,immigration backlash at the heart of british push to leave the e.u.,0
235,https://www.theonion.com/new apple campaign urges consumers to buy iphone for ot 1819573673,new apple campaign urges consumers to buy iphone for other hand,1
973,https://local.theonion.com/everyone in coffee shop can tell trainee a goner 1819578549,everyone in coffee shop can tell trainee a goner,1
3082,https://www.huffingtonpost.com/entry/james corden donald trump steve bannon_us_5a547854e4b0efe47ebc2990,trump and steve bannon look back with rose colored glasses in james corden spoof,0
3368,https://www.huffingtonpost.com/entry/gop senators mitch mcconnell_us_598de146e4b090964296a16a,gop senators throw support behind mitch mcconnell as feud with trump escalates,0
2289,https://www.huffingtonpost.com/entry/victor pinchuk mistral wa_b_6226632.html,"victor pinchuk, mistral warships, and the jews of ukraine",0
2287,https://www.huffingtonpost.com/entry/salvador dali vr video paintings_us_56ac6e70e4b0010e80ea3fa9,step inside salvador dali's surreal paintings with trippy vr video,0
2672,https://www.huffingtonpost.com/entry/trump mueller russia_us_5970c352e4b0aa14ea7819ad,special counsel robert mueller probing trump business transactions: report,0
75,https://www.theonion.com/campbells unveils one big can sized noodle 1822424458,campbell's unveils one big can sized noodle,1
356,https://www.theonion.com/eleven year old has miniskirt pumps vague notion of w 1819565556,"eleven year old has miniskirt, pumps, vague notion of what sex is",1
2707,https://www.huffingtonpost.com/entry/my secret money life i helped bankroll my brother and came to regret it_b_5725510.html,my secret money life: i helped bankroll my brother and came to regret it,0
217,https://www.theonion.com/third world disease eliminated with hot air hand dryers 1819565375,third world disease eliminated with hot air hand dryers,1
1293,https://www.huffingtonpost.com/entry/how to be a parent your child wants to talk to_us_5b081517e4b021e3a19fbcbf,how to be a parent your child wants to talk to,0
531,https://politics.theonion.com/libertarian reluctantly calls fire department 1819567309,libertarian reluctantly calls fire department,1
1213,https://www.huffingtonpost.com/entry/unlocking big datas value_b_5519826.html,unlocking big data's value potential through design with small data,0
2211,https://www.huffingtonpost.com/entry/cheap celeb finds_n_5459012.html,we can't believe we spotted jessica alba in these shoes!,0
2250,https://www.huffingtonpost.com/entry/flightradar24 plane drawings_us_56e69bbce4b065e2e3d65fae,pilot uses gps tracker to draw picture of a plane... with a plane,0
71,https://www.theonion.com/god humbled to be the answer to jeopardy clue 1826072334,god humbled to be the answer to 'jeopardy!' clue,1
385,https://entertainment.theonion.com/study snapping three times leading way to recall movie 1819569673,"study: snapping three times leading way to recall movies, actors",1
2758,https://www.huffingtonpost.com/entry/dnainfo gothamist shut down_us_59fb891be4b0b0c7fa39122e,gothamist sites and dnainfo shut down after staffers unionize,0
2007,https://www.huffingtonpost.com/entry/bruce dern shares hilarious memory of alfred hitchcock_us_56706b14e4b011b83a6ce1c3,bruce dern shares hilarious memory of a girthy alfred hitchcock,0
2924,https://www.huffingtonpost.com/entry/new years resolutions for your marriage_us_56845c02e4b0b958f65b3859,sixteen ways to be a better spouse in two thousand and sixteen,0
220,https://www.theonion.com/thousands of new orleans households still without polit 1819568190,thousands of new orleans households still without political power,1
2425,https://www.huffingtonpost.com/entry/5 bittersweet truths that put life into perspective_b_7464626.html,five bittersweet truths that put life into perspective,0
1915,https://www.huffingtonpost.com/entry/comfortable plane seats coach_us_5682b9d4e4b014efe0d9481a,twister seat could make flying coach way more comfortable,0
1798,https://www.huffingtonpost.com/entry/girl scouts flint crisis_us_569e8ca8e4b04c813761adce,these girl scouts want something done about flint's water crisis,0
813,https://local.theonion.com/we can have differences of opinion and still respect e 1825690281,"we can have differences of opinion and still respect each other,' says betrayer of the one true cause",1
389,https://www.theonion.com/kremlin agent not even going to bother trying to compro 1819579654,kremlin agent not even going to bother trying to compromise trump staffer who will be forced to resign in few months,1
2631,https://www.huffingtonpost.com/entry/13 year old son autism_us_5ae0a2dce4b055fd7fc70a1b,here is what no one says out loud about raising a thirteen year old son with autism,0
773,https://www.theonion.com/new extended paternity leave offers dads more time to l 1819577964,new extended paternity leave offers dads more time to lose colleagues' respect,1
61,https://entertainment.theonion.com/man vows never to watch another sci fi movie with physi 1819566728,man vows never to watch another sci fi movie with physicist friend,1
204,https://www.theonion.com/nation checks out cnn com to see what their old pals th 1819574972,nation checks out cnn.com to see what their old pals the tsarnaevs and castros are up to,1
1837,https://www.huffingtonpost.com/entry/6 reasons trumps wall_us_587b8dfee4b0e58057ff46e3,six reasons why trump's wall is even dumber than most of trump's other ideas,0
1526,https://www.huffingtonpost.comhttp://www.aol.com/article/2015/11/05/dr jill biden explains why community college is one/21259058/,dr. jill biden explains why community college is 'one of america's best kept secrets',0
2263,https://www.huffingtonpost.com/entry/syria family ezzedine meningitis_us_57d2b292e4b06a74c9f41f24,syrian family suffering from meningitis evacuated for treatment,0
419,https://politics.theonion.com/trump hails gorsuch as fierce protector of future amend 1819579577,trump hails gorsuch as fierce protector of future amendment allowing president to temporarily suspend right to assemble,1
1662,https://www.huffingtonpost.com/entry/san bernardino shooting nsa surveillance_us_5664affae4b079b2818f068d,san bernardino shooting revives nsa surveillance debate,0
2502,https://www.huffingtonpost.com/entry/trevor noah trump obama meeting_us_582552fae4b060adb56de29a,trevor noah can't wrap mind around trump obama white house meeting,0
750,https://entertainment.theonion.com/firefighters turned away from exclusive nightclub blaze 1819569929,firefighters turned away from exclusive nightclub blaze,1
3085,https://www.huffingtonpost.com/entry/drunk ron weasley wishing harry potter happy birthday is pure magic_us_55b8cf93e4b0a13f9d1ad5f9,drunk ron weasley wishing harry potter 'happy birthday' is pure magic,0
476,https://www.theonion.com/evil genius cat subpoenaed 1819564718,evil genius' cat subpoenaed,1
1473,https://www.huffingtonpost.com/entry/love the real you the case for self love_b_7018042.html,love the real you: the case for self love,0
3394,https://www.huffingtonpost.com/entry/calculator cover despacito luis fonsi daddy yankee_us_59ae9d04e4b0b5e53100c4b2,despacito' played on two calculators adds up to something special,0
816,https://local.theonion.com/dolphin spends amazing vacation swimming with stockbrok 1819575361,dolphin spends amazing vacation swimming with stockbroker,1
680,https://www.theonion.com/popular new amazon service just comes to your house and 1819917496,popular new amazon service just comes to your house and kills you,1
1990,https://www.huffingtonpost.com/entry/the politics of lgbtq people_b_7537094.html,the politics of lgbtq people: caitlyn jenner and class differences,0
1157,https://www.huffingtonpost.com/entry/trump clinton tweet_us_59be731ce4b086432b07c60c,donald trump retweets joke about violence toward hillary clinton,0
169,https://www.theonion.com/science fiction writer admits unstoppable killing machi 1819569329,science fiction writer admits unstoppable killing machine based on mother,1
1313,https://www.huffingtonpost.com/entry/benjamin netanyahu iran arabs_n_6284350.html,"netanyahu plays nice on iran, arabs in washington speech",0
1885,https://www.huffingtonpost.com/entry/be honest with everyone_b_7146184.html,be honest with everyone,0
3451,https://www.huffingtonpost.com/entry/huffpost hill house republicans vote unanimously to fight later_us_582b8bf3e4b0e39c1fa6e133,huffpost hill house republicans vote unanimously to fight later,0
3187,https://www.huffingtonpost.com/entry/well past second changes the nfl still doesnt get it on domestic violence_b_7004648.html,well past second chances: the nfl still doesn't get it on domestic violence,0
1536,https://www.huffingtonpost.com/entry/george w bush jury duty_us_55c24a4ae4b0138b0bf4bf93,woman meets george w. bush while reporting for jury duty,0
964,https://entertainment.theonion.com/david allan coe waiting outside to kick your ass 1819587100,david allan coe waiting outside to kick your ass,1
3318,https://www.huffingtonpost.com/entry/libya says algerian milit_n_7581630.html,report: algerian militant killed in u.s. strike targeting al qaeda operatives in libya,0
711,https://politics.theonion.com/congressman boehners terror alert skin set back to oran 1819589632,congressman boehner's terror alert skin set back to orange,1
722,https://local.theonion.com/passion with which child demanding balloon actually kin 1819576581,passion with which child demanding balloon actually kind of inspiring,1
788,https://www.theonion.com/kitchenaid unveils spring loaded toaster that allows ra 1825046205,kitchenaid unveils spring loaded toaster that allows rad high schoolers to grab breakfast in midair while leaving house,1
3389,https://www.huffingtonpost.com/entry/interior department methane rule us_us_59134d84e4b050bdca61b863,senate can't pass methane rollback so interior decides to do it anyway,0
1382,https://www.huffingtonpost.com/entry/uk us leaks manchester_us_59268433e4b062f96a340189,uk resumes sharing information with u.s. about attack after trump calls for probe,0
2887,https://www.huffingtonpost.comhttp://traveler.marriott.com/travel hacks/the best taxi and ride hailing apps around the world/,the best taxi and ride hailing apps around the world,0
1646,https://www.huffingtonpost.com/entry/trump trade tariffs twitter_us_5ac51b86e4b09ef3b2430789,trump's trade rhetoric is unhinged. his tariffs aren't.,0
2620,https://www.huffingtonpost.com/entry/beyonce cha cha instagram_n_7342378.html,beyonce shows love for 'cha cha' and lone star beer,0
978,https://www.theonion.com/u s stock market soars after bernanke s reassuring com 1819575260,u.s. stock market soars after bernanke's reassuring comments about 'pacific rim',1
2261,https://www.huffingtonpost.com/entry/kim kardashian breaks down kris jenner reaction_n_7301114.html,kim kardashian breaks down over kris jenner's reaction to bruce jenner,0
2043,https://www.huffingtonpost.com/entry/hilary swank and brother goof on wine servers in most hilarious way_us_5abcf69ae4b06409775e0158,hilary swank and brother goof on wine tasters in hilarious prank,0
346,https://local.theonion.com/asshole from plane greeted at baggage claim by whole fa 1819574329,asshole from plane greeted at baggage claim by whole family,1
1484,https://www.huffingtonpost.com/entry/eliminating the election assistance commission would_us_5981f0e0e4b0b35d274c5f1c,republicans want to defund the commission that fights voting machine hacking,0
1427,https://www.huffingtonpost.com/entry/halloween costume karl lagerfeld_us_56327779e4b0c66bae5bb46a,this halloween costume would make karl lagerfeld proud,0
487,https://www.theonion.com/indian sweatshop worker has to work in the fucking dark 1819573713,indian sweatshop worker has to work in the fucking dark now too,1
1796,https://www.huffingtonpost.com/entry/pharrell cfda fashion icon 2015_n_6901262.html,fourteen reasons why pharrell williams is definitely a fashion icon,0
1488,https://www.huffingtonpost.comhttp://www.slate.com/articles/news_and_politics/politics/2016/04/paul_manafort_isn_t_a_gop_retread_he_s_made_a_career_of_reinventing_tyrants.html,"if you don't think paul manafort can get trump elected, you don't know paul manafort",0
1476,https://www.huffingtonpost.com/entry/years of us government lies could soon result in a kurdish massacre_us_5a75db08e4b01ce33eb32b3a,years of u.s. government lies could soon result in a kurdish massacre,0
28,https://www.theonion.com/north dakota not heard from in 48 hours 1819564531,north dakota not heard from in forty eight hours,1
2666,https://www.huffingtonpost.com/entry/ancestrycom medical research juggernaut_n_7008446.html,how ancestry.com is quietly transforming itself into a medical research juggernaut,0
2581,https://www.huffingtonpost.com/entry/mormon feminists excommunication_n_7647696.html,where mormon feminists stand a year after kate kelly's excommunication,0
887,https://www.theonion.com/new drug offers hope to infertile inner city teens 1819586525,new drug offers hope to infertile inner city teens,1
3000,https://www.huffingtonpost.com/entry/baghdad car bomb_n_6055638.html,massive blast rocks central baghdad,0
60,https://www.theonion.com/friends always on best behavior around neil labute 1819567779,friends always on best behavior around neil labute,1
454,https://www.theonion.com/apple announces plans for new ipad with extra storage d 1819574446,apple announces plans for new ipad with extra storage drawer,1
2698,https://www.huffingtonpost.com/entry/between addict and recovery look how far youve come_us_598433d6e4b0bd82320296bf,between addict and recovery: look how far you've come,0
325,https://sports.theonion.com/dozens of social issues thankful they never had to go t 1819578940,dozens of social issues thankful they never had to go toe to toe with muhammad ali,1
246,https://politics.theonion.com/pollsters admit they underestimated voters adrenal gla 1819579435,pollsters admit they underestimated voters' adrenal glands,1
1540,https://www.huffingtonpost.com/entry/prince harry meghan markle first official event of engagement princess diana_us_5a1eca9be4b0cb0e917d2376,"prince harry, meghan markle's first official post engagement event will be nod to diana",0
2352,https://www.huffingtonpost.com/entry/saffron herndon comedian 10_us_55fc1e30e4b0fde8b0cde267,comedian saffron herndon is ten and already killing audiences,0
3418,https://www.huffingtonpost.com/entry/france boy attack_us_57d5a8e6e4b06a74c9f53156,france arrests fifteen year old boy over 'imminent paris attack,0
2264,https://www.huffingtonpost.com/entry/margarita murillo another_b_5744476.html,margarita murillo: another victim of neoliberalism in honduras?,0
2725,https://www.huffingtonpost.com/entry/bbc planet earth ii sea turtles_us_58504294e4b04c8e2bb23af9,bbc reveals happy ending to 'planet earth ii's' most heartbreaking scene,0
1507,https://www.huffingtonpost.com/entry/cnn kathy griifin_us_592c5a8be4b053f2d2ad7685,cnn cuts ties with kathy griffin,0
1647,https://www.huffingtonpost.com/entry/north carolina progressive prosecutors_us_5af22ea3e4b0aab8a78a067e,progressive prosecutors win primaries in north carolina,0
2901,https://www.huffingtonpost.com/entry/study how long you wait to see a doctor is linked to race employment_us_5613b0cbe4b0baa355ad2621,"study: how long you wait to see a doctor is linked to race, employment",0
3206,https://www.huffingtonpost.com/entry/why we need to laugh_n_6153798.html,why exercising your sense of humor is so important,0
1854,https://www.huffingtonpost.com/entry/tom price insurers obamacare_us_596b76fae4b01741862825c6,tom price says insurers should 'dust off how they did business before obamacare',0
1276,https://www.huffingtonpost.com/entry/lindsey graham sat grades_us_56315907e4b063179910e7fc,lindsey graham got eight hundred on his sats and won't stop talking about his bad grades,0
3445,https://www.huffingtonpost.com/entry/laquan mcdonald burger king video_us_5655c5abe4b072e9d1c1469b,police have no idea how laquan mcdonald footage vanished right after they watched it,0
1429,https://www.huffingtonpost.com/entry/caring for every preemie _b_7445672.html,"caring for every preemie, every day",0
2298,https://www.huffingtonpost.com/entry/lin manuel miranda would like to remind you to put your phone away_us_5733306be4b096e9f0933e98,lin manuel miranda would like to remind you to put your phone away,0
2544,https://www.huffingtonpost.com/entry/bernie sanders booing_us_579768e7e4b0d3568f847c08,bernie sanders has a message for his loudest supporters,0
2922,https://www.huffingtonpost.com/entry/marco rubio credit card data revealed_us_563e92c8e4b0b24aee4a97db,rubio's mysterious credit card data revealed,0
2640,https://www.huffingtonpost.com/entry/40 tweets life with 4 year olds_us_5a45ba46e4b025f99e1ab986,forty tweets that sum up life with four year olds,0
1156,https://www.huffingtonpost.com/entry/powerball ticket winning ticket sold_us_583aebe9e4b01ba68ac4cde7,powerball ticket sold with all winning numbers in $four hundred and twenty one million jackpot,0
251,https://local.theonion.com/weird relative at family reunion knows how everyone rel 1819579336,weird relative at family reunion knows how everyone related to each other,1
187,https://local.theonion.com/area grasshopper kind of a thorax man himself 1819566187,area grasshopper kind of a thorax man himself,1
1409,https://www.huffingtonpost.com/entry/go directly to jail shirt_n_6083208.html,florida man gets arrested with 'go directly to jail' shirt,0
3423,https://www.huffingtonpost.com/entry/roger stone guccifer_us_58c320c9e4b0d1078ca6dbf8,roger stone says his conversation with dnc hackers was 'completely innocuous',0
1753,https://www.huffingtonpost.com/entry/gop marijuana_n_5890784.html,gop congressman warns of the real social ill destroying american values: marijuana,0
129,https://politics.theonion.com/report it still nowhere near okay to act like donald t 1819579444,report: it still nowhere near okay to act like donald trump,1
923,https://www.theonion.com/area man to ask his doctor about xenical propecia cla 1819586733,"area man to ask his doctor about xenical, propecia, claritin, paxil, drixoral, lipitor, tavist d",1
453,https://www.theonion.com/u s upset after aliens land in italy 1819567123,u.s. upset after aliens land in italy,1
405,https://politics.theonion.com/600 pound butter cow sculpture wins iowa caucus 1819573170,six hundred pound butter cow sculpture wins iowa caucus,1
3420,https://www.huffingtonpost.com/entry/apple names jeff williams new coo_us_5672d305e4b0dfd4bcc0c626,apple names jeff williams new coo,0
3214,https://www.huffingtonpost.com/entry/mike pompeo cia_us_582efff2e4b030997bbedf49,donald trump taps tea party rep. mike pompeo to run the cia,0
2723,https://www.huffingtonpost.com/entry/rabbi levi brackman life purpose_n_5452501.html,you don't need god to have a life purpose: rabbi,0
3086,https://www.huffingtonpost.com/entry/six dreamers sue trump administration over daca decision_us_59bfeba4e4b0edff971df1a3,six dreamers sue trump administration over daca decision,0
2147,https://www.huffingtonpost.comhttps://www.washingtonpost.com/news/worldviews/wp/2016/05/26/pakistani husbands can lightly beat their wives islamic council says/,"pakistani husbands can 'lightly beat' their wives, islamic council says",0
2980,https://www.huffingtonpost.com/entry/ohio state fair accident cause_us_5987d5c6e4b08b75dcc7b8d3,"ohio state fair accident caused by 'excessive corrosion,' ride manufacturer says",0
1489,https://www.huffingtonpost.com/entry/why attending a college in a big city_b_7119462.html,why attending a college in a big city is the fastest way to grow your career,0
1629,https://www.huffingtonpost.com/entry/the color you should be wearing to the gym_us_55b92784e4b0224d8834fbe4,orange workout gear that'll legitimately up your gym game,0
2361,https://www.huffingtonpost.com/entry/this desperate dad is trying to ward off the terrible twos_us_57d95d20e4b0aa4b722d8ccd,this desperate dad is trying to ward off the terrible twos,0
1633,https://www.huffingtonpost.com/entry/who gets what the facts o_b_6245634.html,"protect inventors or take down trolls? patent reform with senator john cornyn, ceo innovestion, and rackspace",0
1736,https://www.huffingtonpost.com/entry/down with cutesy cleaning_n_5642021.html,down with cutesy cleaning supplies!,0
1959,https://www.huffingtonpost.com/entry/sadiq khan mayor london brexit_us_576dafa7e4b017b379f60d21,london's mayor to eu citizens: 'you are very welcome here',0
2363,https://www.huffingtonpost.com/entry/opinion kuttner trump davos_us_5a6e989ae4b0ddb658c7cc66,trump the globalist plutocrat,0
2456,https://www.huffingtonpost.com/entry/the top 10 workout songs for january 2018_us_5a4be79be4b0df0de8b06d90,the top ten workout songs for january two thousand and eighteen,0
1827,https://www.huffingtonpost.com/entry/linda brown brown v board of education dies 76_us_5ab95c54e4b008c9e5fa5aa1,"linda brown, center of brown v. board of education, dies at seventy six",0
3071,https://www.huffingtonpost.comhttp://www.thewrap.com/20th century fox paramount have no female directors through 2018/,"twentyth century fox, paramount have no female directors through two thousand and eighteen",0
191,https://local.theonion.com/area man uses wtc attack as excuse to call ex girlfrien 1819566193,area man uses wtc attack as excuse to call ex girlfriend,1
1563,https://www.huffingtonpost.com/entry/confessions of a secret dog stalker_us_576af60fe4b065534f48c7c8,confessions of a secret dog stalker,0
